title,url,city,image_url
Las Vegas: The Strip's Celebrity Chefs Tour or Downtown Food Tour,https://www.trip.com/things-to-do/detail/16164028/?Allianceid=8675451&SID=319479553,Las Vegas,https://ak-d.tripcdn.com/images//0581s12000nq5m8xbD380_C_568_320.jpg_.webp?_fr=wc
Wild West Sunset Horseback Ride with Dinner from Las Vegas,https://www.trip.com/things-to-do/detail/16164495/?Allianceid=8675451&SID=319479553,Las Vegas,https://ak-d.tripcdn.com/images//0585m12000nj3k8h29B5D_C_568_320.jpg_.webp?_fr=wc
Grand Canyon South Rim Sunset Tour wth Dinner included,https://www.trip.com/things-to-do/detail/106250343/?Allianceid=8675451&SID=319479553,Las Vegas,https://ak-d.tripcdn.com/images/0354312000novi5nmD383_C_568_320.jpg_.webp?_fr=wc
Las Vegas: Hoover Dam & Valley of Fire Day Trip with Brunch,https://www.trip.com/things-to-do/detail/106372658/?Allianceid=8675451&SID=319479553,Las Vegas,https://ak-d.tripcdn.com/images//0581712000r47kjliC2A5_C_568_320.jpg_.webp?_fr=wc
Greater Zion: Couples UTV Tour with Food,https://www.trip.com/things-to-do/detail/106168365/?Allianceid=8675451&SID=319479553,Las Vegas,https://ak-d.tripcdn.com/images/0352u12000nweehmpCD05_C_568_320.jpg_.webp?_fr=wc
Las Vegas: Guided Food Tour + Helicopter Ride,https://www.trip.com/things-to-do/detail/106072408/?Allianceid=8675451&SID=319479553,Las Vegas,https://ak-d.tripcdn.com/images/0353q12000fz2ecs15849_C_568_320.jpg_.webp?_fr=wc
From Las Vegas: Desert Sunset Horseback Ride with BBQ Dinner,https://www.trip.com/things-to-do/detail/107381644/?Allianceid=8675451&SID=319479553,Las Vegas,https://ak-d.tripcdn.com/images//0582d12000sb6ejks288A_C_568_320.jpg_.webp?_fr=wc
"Grand Canyon West, Hoover Dam & 7 Magic Mountains Tour with Optional Skywalk",https://www.trip.com/things-to-do/detail/94603928/?Allianceid=8675451&SID=319479553,Las Vegas,https://ak-d.tripcdn.com/images/0356p12000omu97il9AD5_C_568_320.jpg_.webp?_fr=wc
"Go City: Las Vegas All-Inclusive Pass (Discover over 40 top attractions | Cirque du Soleil, The Tower at the STRAT & more)",https://www.trip.com/things-to-do/detail/46680352/?Allianceid=8675451&SID=319479553,Las Vegas,https://ak-d.tripcdn.com/images/0351h12000jinu6sj2FA7_C_568_320.jpg_.webp?_fr=wc
"Desert Treasures: Hoover Dam, Boulder City & Seven Magic Mountains",https://www.trip.com/things-to-do/detail/94952555/?Allianceid=8675451&SID=319479553,Las Vegas,https://ak-d.tripcdn.com/images/0355512000mca03ilECE3_C_568_320.jpg_.webp?_fr=wc
Las Vegas: Chippendales Show at Planet Hollywood,https://www.trip.com/things-to-do/detail/98780756/?Allianceid=8675451&SID=319479553,Las Vegas,https://ak-d.tripcdn.com/images//0586o12000ofmvz4w08B0_C_568_320.jpg_.webp?_fr=wc
Las Vegas Strip Night Helicopter Tour,https://www.trip.com/things-to-do/detail/106760905/?Allianceid=8675451&SID=319479553,Las Vegas,https://ak-d.tripcdn.com/images//0582r12000s8zx39o357D_C_568_320.jpg_.webp?_fr=wc
All Shook Up: Elvis Tribute Show at Alexis Park Resort Hotel,https://www.trip.com/things-to-do/detail/43311267/?Allianceid=8675451&SID=319479553,Las Vegas,https://ak-d.tripcdn.com/images//0585w12000mzofm898E34_C_568_320.jpg_.webp?_fr=wc
V - The Ultimate Variety Show at Planet Hollywood Resort and Casino,https://www.trip.com/things-to-do/detail/16164626/?Allianceid=8675451&SID=319479553,Las Vegas,https://ak-d.tripcdn.com/images//0581f12000nj3p4ch0FD1_C_568_320.jpg_.webp?_fr=wc
Las Vegas sightseeing helicopter (including hotel shuttle),https://www.trip.com/things-to-do/detail/57501135/?Allianceid=8675451&SID=319479553,Las Vegas,https://ak-d.tripcdn.com/images//0585s12000qofrzd136E1_C_568_320.jpg_.webp?_fr=wc
Steve Falcon's Comedy Hypnosis Hour,https://www.trip.com/things-to-do/detail/36386707/?Allianceid=8675451&SID=319479553,Las Vegas,https://ak-d.tripcdn.com/images//0581812000nl9bcwtFABF_C_568_320.jpg_.webp?_fr=wc
All Motown – Motown Magic in Vegas,https://www.trip.com/things-to-do/detail/36469598/?Allianceid=8675451&SID=319479553,Las Vegas,https://ak-d.tripcdn.com/images//0581w12000nl9bvb0AEAE_C_568_320.jpg_.webp?_fr=wc
Popovich Comedy Pet Theater at Planet Hollywood Resort and Casino,https://www.trip.com/things-to-do/detail/16141805/?Allianceid=8675451&SID=319479553,Las Vegas,https://ak-d.tripcdn.com/images//0585b12000mz1oe1u38CC_C_568_320.jpg_.webp?_fr=wc
Exclusive Hoover Dam Power Plant Tour w/ Seven Magic Mountains,https://www.trip.com/things-to-do/detail/94950459/?Allianceid=8675451&SID=319479553,Las Vegas,https://ak-d.tripcdn.com/images/0353y12000mc9zxq944B7_C_568_320.jpg_.webp?_fr=wc
Mat Franco Magic Reinvented Nightly at the LINQ Hotel and Casino,https://www.trip.com/things-to-do/detail/16058783/?Allianceid=8675451&SID=319479553,Las Vegas,https://ak-d.tripcdn.com/images//0580g12000nj0w37tE5B7_C_568_320.jpg_.webp?_fr=wc
"1-day private chartered tour to Las Vegas, Sphere, Lake Las Vegas and Hoover Dam in the US",https://www.trip.com/things-to-do/detail/107398411/?Allianceid=8675451&SID=319479553,Las Vegas,https://ak-d.tripcdn.com/images/0350r12000sb8iov6ABE7_C_568_320.png_.webp?_fr=wc
"1-day private chartered tour to Las Vegas, Sphere, Lake Las Vegas and Sunset Park in the US",https://www.trip.com/things-to-do/detail/107398920/?Allianceid=8675451&SID=319479553,Las Vegas,https://ak-d.tripcdn.com/images/0351912000sb93lcyE853_C_568_320.png_.webp?_fr=wc
Grand celebration helicopter tour of Grand Canyon with picnic,https://www.trip.com/things-to-do/detail/84047159/?Allianceid=8675451&SID=319479553,Las Vegas,https://ak-d.tripcdn.com/images//0586c12000n2ac4ad8BEC_C_568_320.jpg_.webp?_fr=wc
Helicopter tour from Las Vegas to the West Rim of the Grand Canyon (Experience the unique charm of Las Vegas and the Grand Canyon),https://www.trip.com/things-to-do/detail/102447878/?Allianceid=8675451&SID=319479553,Las Vegas,https://ak-d.tripcdn.com/images//0584e12000qq9tka15C38_C_568_320.jpg_.webp?_fr=wc
"Nevada Valley of Fire Helicopter Wedding Experience (Includes Bridal Bouquet, Officiant, Photographer, Wedding Host, and All-Inclusive Fees)",https://www.trip.com/things-to-do/detail/103048837/?Allianceid=8675451&SID=319479553,Las Vegas,https://ak-d.tripcdn.com/images//0583u12000r3rkc7b610D_C_568_320.jpg_.webp?_fr=wc
Las Vegas: Night Helicopter Flight over Las Vegas Strip,https://www.trip.com/things-to-do/detail/106224140/?Allianceid=8675451&SID=319479553,Las Vegas,https://ak-d.tripcdn.com/images/0354v12000npw30q9AE3F_C_568_320.jpg_.webp?_fr=wc
Purple Reign: The Prince Tribute Show at Planet Hollywood,https://www.trip.com/things-to-do/detail/16164349/?Allianceid=8675451&SID=319479553,Las Vegas,https://ak-d.tripcdn.com/images//0585012000nj3ir2e7AB7_C_568_320.jpg_.webp?_fr=wc
Las Vegas Strip: Helicopter Night Flight Tour,https://www.trip.com/things-to-do/detail/105615350/?Allianceid=8675451&SID=319479553,Las Vegas,https://ak-d.tripcdn.com/images/0353312000q0s952d0EBC_C_568_320.jpg_.webp?_fr=wc
Grand Canyon Helicopter Landing Tour with Vegas Strip,https://www.trip.com/things-to-do/detail/104901665/?Allianceid=8675451&SID=319479553,Las Vegas,https://ak-d.tripcdn.com/images//0584j12000oflhlmk13AF_C_568_320.jpg_.webp?_fr=wc
Grand Canyon Helicopter Landing Tour from Las Vegas,https://www.trip.com/things-to-do/detail/107417480/?Allianceid=8675451&SID=319479553,Las Vegas,https://ak-d.tripcdn.com/images//0583012000sbfryzeD7B0_C_568_320.jpg_.webp?_fr=wc
"Las Vegas: Mojave, Red Rock Sign and 7 Magic Mountains Tour",https://www.trip.com/things-to-do/detail/105940053/?Allianceid=8675451&SID=319479553,Las Vegas,https://ak-d.tripcdn.com/images//0580712000q2q3u6012C9_C_568_320.jpg_.webp?_fr=wc
"Grand Canyon West Rim bus tour with Hoover Dam photo stop, helicopter and Skywalk ticket",https://www.trip.com/things-to-do/detail/84000201/?Allianceid=8675451&SID=319479553,Las Vegas,https://ak-d.tripcdn.com/images//0584212000monfxx3BFB9_C_568_320.jpg_.webp?_fr=wc
Magic Mike Live Las Vegas at SAHARA Las Vegas,https://www.trip.com/things-to-do/detail/16055134/?Allianceid=8675451&SID=319479553,Las Vegas,https://ak-d.tripcdn.com/images//0581912000ogjd2ibCD8D_C_568_320.jpg_.webp?_fr=wc
PRIVATE Grand Canyon from Sedona - Just your group,https://www.trip.com/things-to-do/detail/106854767/?Allianceid=8675451&SID=319479553,Las Vegas,https://ak-d.tripcdn.com/images//0582612000nqilkgz736B_C_568_320.jpg_.webp?_fr=wc
"1-day private chartered tour to Las Vegas, Grand Canyon West and Grand Canyon West Skywalk",https://www.trip.com/things-to-do/detail/107405552/?Allianceid=8675451&SID=319479553,Las Vegas,https://aw-d.tripcdn.com/images/0350o12000sbaemk0AFA8_C_568_320.png?_fr=wc&_down=1
1-day private chartered tour to Grand Canyon West and Hoover Dam,https://www.trip.com/things-to-do/detail/107404560/?Allianceid=8675451&SID=319479553,Las Vegas,https://aw-d.tripcdn.com/images/0351b12000sbadv8d1D24_C_568_320.png?_fr=wc&_down=1
Small-Group or Private Grand Canyon with Sedona Tour from Phoenix,https://www.trip.com/things-to-do/detail/106909368/?Allianceid=8675451&SID=319479553,Las Vegas,https://aw-d.tripcdn.com/images//0583912000np8xcq5F447_C_568_320.jpg?_fr=wc&_down=1
Zhangye Private Day Tour: Pingshan Lake Grand Canyon & Zhangye Colorful Danxia Scenic Spot,https://www.trip.com/things-to-do/detail/103741024/?Allianceid=8675451&SID=319479553,Las Vegas,https://ak-d.tripcdn.com/images//0583q12000rrfm2naA6F1_C_568_320.jpg_.webp?_fr=wc
Full day Private tour with Glass Bridge in Grand Canyon and Yellow Dragon cave,https://www.trip.com/things-to-do/detail/100675341/?Allianceid=8675451&SID=319479553,Las Vegas,https://ak-d.tripcdn.com/images/0350l12000phuv6949BFE_C_568_320.jpg_.webp?_fr=wc
1-Day Private Tour: Zhangjiajie Glass Bridge Grand Canyon Attraction + Yellow Dragon Cave,https://www.trip.com/things-to-do/detail/102164069/?Allianceid=8675451&SID=319479553,Las Vegas,https://ak-d.tripcdn.com/images//0582m12000qmp1cp4779A_C_568_320.jpg_.webp?_fr=wc
Flexible Private Day Tour of Guangzhou (Glass Grand Canyon + Optional Landmark Attraction),https://www.trip.com/things-to-do/detail/96216567/?Allianceid=8675451&SID=319479553,Las Vegas,https://ak-d.tripcdn.com/images//0585x12000o2pnyf61DA3_C_568_320.jpg_.webp?_fr=wc
"1-day private chartered tour to Las Vegas Red Rock Canyon National Conservation Area, Seven Magic Mountains and Hoover Dam",https://www.trip.com/things-to-do/detail/107409777/?Allianceid=8675451&SID=319479553,Las Vegas,https://ak-d.tripcdn.com/images/0353l12000sbb4yg4B0BC_C_568_320.png_.webp?_fr=wc
Hoover Dam VIP Inside Exploration Tour,https://www.trip.com/things-to-do/detail/53494566/?Allianceid=8675451&SID=319479553,Las Vegas,https://ak-d.tripcdn.com/images/0350f12000rgmdswtC230_C_568_320.jpg_.webp?_fr=wc
Hoover Dam Comedy Tour with Lunch and Comedy Club Tickets,https://www.trip.com/things-to-do/detail/106909607/?Allianceid=8675451&SID=319479553,Las Vegas,https://ak-d.tripcdn.com/images//0581312000ryw70v77CF2_C_568_320.jpg_.webp?_fr=wc
"Las Vegas: Grand Canyon, Hoover Dam & 7 Magic Mountains Tour",https://www.trip.com/things-to-do/detail/106111567/?Allianceid=8675451&SID=319479553,Las Vegas,https://ak-d.tripcdn.com/images//0586s12000o7qegmx1725_C_568_320.jpg_.webp?_fr=wc
Lake Mead: VIP Kayak Tour to Hoover Dam with Lunch,https://www.trip.com/things-to-do/detail/106128408/?Allianceid=8675451&SID=319479553,Las Vegas,https://ak-d.tripcdn.com/images//0581e12000q3idgofFB4B_C_568_320.jpg_.webp?_fr=wc
Ultimate VIP Hoover Dam Tour from Las Vegas with Lunch,https://www.trip.com/things-to-do/detail/106931078/?Allianceid=8675451&SID=319479553,Las Vegas,https://ak-d.tripcdn.com/images//0585612000n139apv69E8_C_568_320.jpg_.webp?_fr=wc
Las Vegas: Hoover Dam Ultimate VIP Tour with Lunch,https://www.trip.com/things-to-do/detail/106279873/?Allianceid=8675451&SID=319479553,Las Vegas,https://ak-d.tripcdn.com/images/0352f12000nw94qzj4513_C_568_320.jpg_.webp?_fr=wc
Las Vegas: Hoover Dam and Seven Magic Mountains Tour,https://www.trip.com/things-to-do/detail/106253109/?Allianceid=8675451&SID=319479553,Las Vegas,https://ak-d.tripcdn.com/images/0351e12000npwb9zj3AA2_C_568_320.jpg_.webp?_fr=wc
Grand Canyon West plus Hoover Dam VIP Day Tour from Las Vegas,https://www.trip.com/things-to-do/detail/107129958/?Allianceid=8675451&SID=319479553,Las Vegas,https://ak-d.tripcdn.com/images//0582112000n16f4gmAFB4_C_568_320.jpg_.webp?_fr=wc
"Small Group Grand Canyon, Hoover Dam, 7 Magic Mountains VIP Tour",https://www.trip.com/things-to-do/detail/106890815/?Allianceid=8675451&SID=319479553,Las Vegas,https://ak-d.tripcdn.com/images//0580312000nozcfuh3E1D_C_568_320.jpg_.webp?_fr=wc
"Hoover Dam,7 Magic Mountains VIP Experience Small Group Tour",https://www.trip.com/things-to-do/detail/108744615/?Allianceid=8675451&SID=319479553,Las Vegas,https://ak-d.tripcdn.com/images//0583812000o4z1yl51D1C_C_568_320.jpg_.webp?_fr=wc
Grand Canyon Helicopter Air Tour From Las Vegas,https://www.trip.com/things-to-do/detail/107417759/?Allianceid=8675451&SID=319479553,Las Vegas,https://ak-d.tripcdn.com/images//0583w12000sbfvvqy0C12_C_568_320.jpg_.webp?_fr=wc
Las Vegas: Grand Canyon West Rim Tour with Helicopter Flight,https://www.trip.com/things-to-do/detail/105973488/?Allianceid=8675451&SID=319479553,Las Vegas,https://ak-d.tripcdn.com/images/0354s12000novnkjx2F4C_C_568_320.jpg_.webp?_fr=wc
Las Vegas: Grand Canyon West Rim VIP Luxury Small Group Tour,https://www.trip.com/things-to-do/detail/105949597/?Allianceid=8675451&SID=319479553,Las Vegas,https://ak-d.tripcdn.com/images/0354u12000nq1cnxhDB07_C_568_320.jpg_.webp?_fr=wc
Grand Canyon Helicopter Tour with Black Canyon Rafting,https://www.trip.com/things-to-do/detail/106318603/?Allianceid=8675451&SID=319479553,Las Vegas,https://ak-d.tripcdn.com/images//0585212000o5dk987917E_C_568_320.jpg_.webp?_fr=wc
Grand Canyon West: VIP Tour from Las Vegas + Hoover Dam Stop + Optional Skywalk,https://www.trip.com/things-to-do/detail/105686650/?Allianceid=8675451&SID=319479553,Las Vegas,https://ak-d.tripcdn.com/images/0356i12000q1x10omF2D1_C_568_320.jpg_.webp?_fr=wc
Vegas: Antelope Canyon & Horseshoe Bend VIP Small Group Tour,https://www.trip.com/things-to-do/detail/106360433/?Allianceid=8675451&SID=319479553,Las Vegas,https://ak-d.tripcdn.com/images//0581712000o7zqe63954A_C_568_320.jpg_.webp?_fr=wc
1-day private chartered tour to Las Vegas and Death Valley National Park in the US,https://www.trip.com/things-to-do/detail/107405916/?Allianceid=8675451&SID=319479553,Las Vegas,https://ak-d.tripcdn.com/images/0350j12000sbatimg0039_C_568_320.png_.webp?_fr=wc
"1-day private chartered tour to Las Vegas, Red Rock Canyon National Conservation Area and Spring Mountain Ranch State Park",https://www.trip.com/things-to-do/detail/107408617/?Allianceid=8675451&SID=319479553,Las Vegas,https://ak-d.tripcdn.com/images/0354v12000sbbgyk5A6D7_C_568_320.png_.webp?_fr=wc
1-day private chartered tour to Las Vegas Strip and Red Rock Canyon National Conservation Area,https://www.trip.com/things-to-do/detail/107407441/?Allianceid=8675451&SID=319479553,Las Vegas,https://ak-d.tripcdn.com/images/0353e12000sbb5ggwE430_C_568_320.png_.webp?_fr=wc
Red Rock Canyon: Helicopter Tour from Las Vegas + Private Landing,https://www.trip.com/things-to-do/detail/108550915/?Allianceid=8675451&SID=319479553,Las Vegas,https://ak-d.tripcdn.com/images/0355h12000sna9l40CB74_C_568_320.jpg_.webp?_fr=wc
PRIVATE Sedona Jeep Tour 4X4 Excursion - Red Rock West Trail,https://www.trip.com/things-to-do/detail/106931312/?Allianceid=8675451&SID=319479553,Las Vegas,https://ak-d.tripcdn.com/images//0582k12000nu07n9322BB_C_568_320.jpg_.webp?_fr=wc
PRIVATE Sedona Jeep Tour Mild 4X4 - Red Rock Panoramic,https://www.trip.com/things-to-do/detail/107002947/?Allianceid=8675451&SID=319479553,Las Vegas,https://ak-d.tripcdn.com/images//0584812000nuai5k73D95_C_568_320.jpg_.webp?_fr=wc
1-day private chartered tour to Las Vegas and Zion National Park,https://www.trip.com/things-to-do/detail/107406401/?Allianceid=8675451&SID=319479553,Las Vegas,https://ak-d.tripcdn.com/images/0354612000sbawdde094D_C_568_320.png_.webp?_fr=wc
St. George and Zion: Private Photoshoot in Scenic Landscapes,https://www.trip.com/things-to-do/detail/108740204/?Allianceid=8675451&SID=319479553,Las Vegas,https://ak-d.tripcdn.com/images//0582b12000o4sqwukF254_C_568_320.jpg_.webp?_fr=wc
Foreign Tourists: Jade Dragon Snow Mountain Guaranteed Glacier Cableway + VIP Impression,https://www.trip.com/things-to-do/detail/92144123/?Allianceid=8675451&SID=319479553,Las Vegas,https://ak-d.tripcdn.com/images/0352312000kotj4b638DD_C_568_320.jpg_.webp?_fr=wc
Jade Dragon (Yulong) Snow Mountain Guaranteed Glacier Cableway Tickets with VIP Impression,https://www.trip.com/things-to-do/detail/94723294/?Allianceid=8675451&SID=319479553,Las Vegas,https://ak-d.tripcdn.com/images/0355612000ivqcjcdC045_C_568_320.jpg_.webp?_fr=wc
Vancouver: Coastal Mountain Landing Helicopter Tour,https://www.trip.com/things-to-do/detail/106332528/?Allianceid=8675451&SID=319479553,Las Vegas,https://ak-d.tripcdn.com/images//0582v12000o9if0v66F3A_C_568_320.jpg_.webp?_fr=wc
1-day private chartered tour to Las Vegas and Valley of Fire State Park,https://www.trip.com/things-to-do/detail/107407941/?Allianceid=8675451&SID=319479553,Las Vegas,https://ak-d.tripcdn.com/images/0350w12000sbb8s2bF3F0_C_568_320.png_.webp?_fr=wc
"Valley of Fire, Seven Magic Mountains & Welcome to Las Vegas Sign: Guided Tour",https://www.trip.com/things-to-do/detail/105738486/?Allianceid=8675451&SID=319479553,Las Vegas,https://ak-d.tripcdn.com/images/0354212000q0ndfpo2FEB_C_568_320.jpg_.webp?_fr=wc
Kunming Private In-depth Day Tour to Dongchuan Red Land: Dive into Terraced Fields of Fire,https://www.trip.com/things-to-do/detail/103248195/?Allianceid=8675451&SID=319479553,Las Vegas,https://ak-d.tripcdn.com/images//0585j12000ntocl5s3FD0_C_568_320.jpg_.webp?_fr=wc
Johor Desaru Half-Day Private Tour | Mini Zoo + Fireflies | All-Inclusive Admission | Departure from Johor Bahru,https://www.trip.com/things-to-do/detail/95830806/?Allianceid=8675451&SID=319479553,Las Vegas,https://ak-d.tripcdn.com/images/0351812000rbcoz698497_C_568_320.png_.webp?_fr=wc
Las Vegas Strip Helicopter Flight,https://www.trip.com/things-to-do/detail/107726760/?Allianceid=8675451&SID=319479553,Las Vegas,https://ak-d.tripcdn.com/images//0585912000seugxewC946_C_568_320.jpg_.webp?_fr=wc
Grand Canyon West Rim Bus and Helicopter Tour,https://www.trip.com/things-to-do/detail/106761077/?Allianceid=8675451&SID=319479553,Las Vegas,https://ak-d.tripcdn.com/images//0582612000s8zxt5x029E_C_568_320.jpg_.webp?_fr=wc
Grand Canyon: Skywalk + Helicopter Flight + Boat Ride from Las Vegas,https://www.trip.com/things-to-do/detail/105616225/?Allianceid=8675451&SID=319479553,Las Vegas,https://ak-d.tripcdn.com/images/0357112000fz32183AFBD_C_568_320.jpg_.webp?_fr=wc
Grand Canyon: Helicopter Flight + Skywalk Entry,https://www.trip.com/things-to-do/detail/108590139/?Allianceid=8675451&SID=319479553,Las Vegas,https://ak-d.tripcdn.com/images/0355212000snog3zwF0EC_C_568_320.jpg_.webp?_fr=wc
Grand Canyon: Day or Sunset Helicopter Flight with Landing + Snack & Champagne,https://www.trip.com/things-to-do/detail/108931582/?Allianceid=8675451&SID=319479553,Las Vegas,https://ak-d.tripcdn.com/images/0350y12000squa2kl3AC1_C_568_320.jpg_.webp?_fr=wc
Grand Canyon: Day Trip from Las Vegas with 20-Min Helicopter Flight + Lunch,https://www.trip.com/things-to-do/detail/105825737/?Allianceid=8675451&SID=319479553,Las Vegas,https://ak-d.tripcdn.com/images/0352w12000q0xnqhr053A_C_568_320.jpg_.webp?_fr=wc
Grand Canyon National Park: Hummer or Helicopter Tour + Flight from Boulder City,https://www.trip.com/things-to-do/detail/105796425/?Allianceid=8675451&SID=319479553,Las Vegas,https://ak-d.tripcdn.com/images/0351z12000q0u1dx991C4_C_568_320.jpg_.webp?_fr=wc
Grand Canyon: Helicopter Flight with Top & Bottom Landing + Snack & Champagne,https://www.trip.com/things-to-do/detail/108590259/?Allianceid=8675451&SID=319479553,Las Vegas,https://ak-d.tripcdn.com/images/0355b12000snojvgcE956_C_568_320.jpg_.webp?_fr=wc
Grand Canyon: VIP West Rim Helicopter Tour from Las Vegas,https://www.trip.com/things-to-do/detail/105627510/?Allianceid=8675451&SID=319479553,Las Vegas,https://ak-d.tripcdn.com/images/0350m12000fz2zrzu3610_C_568_320.jpg_.webp?_fr=wc
Grand Canyon: Helicopter Landing from Las Vegas + Optional Sunset Return,https://www.trip.com/things-to-do/detail/105607765/?Allianceid=8675451&SID=319479553,Las Vegas,https://ak-d.tripcdn.com/images/0354i12000q0mwnrgAD76_C_568_320.jpg_.webp?_fr=wc
Grand Canyon: Grand Celebration Helicopter Tour,https://www.trip.com/things-to-do/detail/105627517/?Allianceid=8675451&SID=319479553,Las Vegas,https://ak-d.tripcdn.com/images/0356612000fz2j397768F_C_568_320.jpg_.webp?_fr=wc
"Las Vegas Strip & Neon Museum: Helicopter Night Flight, Entry Ticket + Transfer",https://www.trip.com/things-to-do/detail/105578229/?Allianceid=8675451&SID=319479553,Las Vegas,https://ak-d.tripcdn.com/images/0352p12000q0lbyh6B74A_C_568_320.jpg_.webp?_fr=wc
Grand Canyon National Park: Day Trip with Optional Hummer or Helicopter Tour,https://www.trip.com/things-to-do/detail/105871613/?Allianceid=8675451&SID=319479553,Las Vegas,https://ak-d.tripcdn.com/images/0352x12000q0pocua71B3_C_568_320.jpg_.webp?_fr=wc
Las Vegas: Grand Canyon Helicopter West Rim Flight & Options,https://www.trip.com/things-to-do/detail/106302857/?Allianceid=8675451&SID=319479553,Las Vegas,https://ak-d.tripcdn.com/images//0585412000s79rucf8C7B_C_568_320.jpg_.webp?_fr=wc
1-Day Tour to Grand Canyon West Rim (Includes Helicopter Ride + Sightseeing Cruise Ticket),https://www.trip.com/things-to-do/detail/69207170/?Allianceid=8675451&SID=319479553,Las Vegas,https://ak-d.tripcdn.com/images/0107112000atyjpdi70F4_C_568_320.jpg_.webp?_fr=wc
Grand Canyon West + Hoover Dam 1-day tour with optional glass bridge/helicopter + cruise upgrade,https://www.trip.com/things-to-do/detail/100578446/?Allianceid=8675451&SID=319479553,Las Vegas,https://ak-d.tripcdn.com/images/0353012000p9c19e4D51F_C_568_320.jpg_.webp?_fr=wc
2-Hour Private Guided Sidecar Tour in Las Vegas,https://www.trip.com/things-to-do/detail/106846620/?Allianceid=8675451&SID=319479553,Las Vegas,https://ak-d.tripcdn.com/images//0583f12000o0q3aka3B89_C_568_320.jpg_.webp?_fr=wc
Valley of Fire and Seven Magic Mountains: Day Tour from Las Vegas,https://www.trip.com/things-to-do/detail/105861589/?Allianceid=8675451&SID=319479553,Las Vegas,https://ak-d.tripcdn.com/images/0355w12000q0s77eg4EA7_C_568_320.jpg_.webp?_fr=wc
VEGAS! The SHOW at Planet Hollywood Resort and Casino,https://www.trip.com/things-to-do/detail/107133576/?Allianceid=8675451&SID=319479553,Las Vegas,https://ak-d.tripcdn.com/images//0581112000nufbd7l6405_C_568_320.jpg_.webp?_fr=wc
Giant Shopping Cart Limo Ride in Las Vegas,https://www.trip.com/things-to-do/detail/82285744/?Allianceid=8675451&SID=319479553,Las Vegas,https://ak-d.tripcdn.com/images//0585q12000n22343f079E_C_568_320.jpg_.webp?_fr=wc
Big Bus Las Vegas: Sightseeing Night Tour by Open-Top Bus,https://www.trip.com/things-to-do/detail/16164588/?Allianceid=8675451&SID=319479553,Las Vegas,https://ak-d.tripcdn.com/images//0581w12000mz2hm00EB51_C_568_320.jpg_.webp?_fr=wc
MGV-Machine Guns Vegas-Indoor Shooting Experiences,https://www.trip.com/things-to-do/detail/52022077/?Allianceid=8675451&SID=319479553,Las Vegas,https://ak-d.tripcdn.com/images/0350912000rgpjzbn19B1_C_568_320.jpg_.webp?_fr=wc
"Las Vegas: Grand Canyon Sunrise, Antelope canyon, Horseshoe",https://www.trip.com/things-to-do/detail/106267131/?Allianceid=8675451&SID=319479553,Las Vegas,https://ak-d.tripcdn.com/images/0351112000nq12ge07384_C_568_320.jpg_.webp?_fr=wc
Lower Antelope Canyon and Horseshoe Bend Day Tour with Lunch,https://www.trip.com/things-to-do/detail/107037418/?Allianceid=8675451&SID=319479553,Las Vegas,https://ak-d.tripcdn.com/images//0582x12000r52cjr8AEF4_C_568_320.jpg_.webp?_fr=wc
"Grand Canyon West, Hoover Dam Stop and Optional Lunch and Skywalk",https://www.trip.com/things-to-do/detail/106986120/?Allianceid=8675451&SID=319479553,Las Vegas,https://ak-d.tripcdn.com/images//0586312000qpdsmqgC79A_C_568_320.jpg_.webp?_fr=wc
Outdoor Shooting Experience with Transfer and Lunch in Las Vegas,https://www.trip.com/things-to-do/detail/82259845/?Allianceid=8675451&SID=319479553,Las Vegas,https://ak-d.tripcdn.com/images//0584712000nwdu5oi9434_C_568_320.jpg_.webp?_fr=wc
Antelope Canyon & Horseshoe Bend,https://www.trip.com/things-to-do/detail/106760968/?Allianceid=8675451&SID=319479553,Las Vegas,https://ak-d.tripcdn.com/images//0581d12000s90sr3b260E_C_568_320.jpg_.webp?_fr=wc
Thunder from Down Under at the Excalibur Hotel and Casino,https://www.trip.com/things-to-do/detail/16164047/?Allianceid=8675451&SID=319479553,Las Vegas,https://ak-d.tripcdn.com/images//0581g12000s9frs24716C_C_568_320.jpg_.webp?_fr=wc
Valley of Fire State Park 1-day tour | Premium small group of no more than 12 people,https://www.trip.com/things-to-do/detail/100611963/?Allianceid=8675451&SID=319479553,Las Vegas,https://ak-d.tripcdn.com/images/0353q12000pfaekpm622E_C_568_320.jpg_.webp?_fr=wc
"Las Vegas MGV Indoor Shooting - Live Ammunition Shooting, Thrilling Experience with Professional Instructor Guidance",https://www.trip.com/things-to-do/detail/51601181/?Allianceid=8675451&SID=319479553,Las Vegas,https://ak-d.tripcdn.com/images/0350712000rgpban2567A_C_568_320.jpg_.webp?_fr=wc
Las Vegas Desert ATV Experience,https://www.trip.com/things-to-do/detail/48132280/?Allianceid=8675451&SID=319479553,Las Vegas,https://ak-d.tripcdn.com/images//0586s12000nmbb5thFD90_C_568_320.jpg_.webp?_fr=wc
The Mentalist at Planet Hollywood Resort and Casino,https://www.trip.com/things-to-do/detail/16090094/?Allianceid=8675451&SID=319479553,Las Vegas,https://ak-d.tripcdn.com/images//0580x12000mz27dwk1121_C_568_320.jpg_.webp?_fr=wc
Half-Day Mojave Desert ATV Tour from Las Vegas,https://www.trip.com/things-to-do/detail/16029621/?Allianceid=8675451&SID=319479553,Las Vegas,https://ak-d.tripcdn.com/images//0580w12000nizezrdD865_C_568_320.jpg_.webp?_fr=wc
