title,url,city,image_url
Sunrise at Grand Canyon + highlights tour to Antelope Canyon & Horseshoe Bend (departing from Las Vegas),https://www.trip.com/things-to-do/detail/107327525/?Allianceid=8675451&SID=319479553,Las Vegas,https://ak-d.tripcdn.com/images/0354t12000sav684t3352_C_568_320.png_.webp?_fr=wc
Morning Horseback Ride with Breakfast from Las Vegas,https://www.trip.com/things-to-do/detail/16164769/?Allianceid=8675451&SID=319479553,Las Vegas,https://ak-d.tripcdn.com/images//0585e12000mz1vqgr66B5_C_568_320.jpg_.webp?_fr=wc
Go City - Las Vegas All-Inclusive Pass - Access to 45+ Attractions,https://www.trip.com/things-to-do/detail/106760954/?Allianceid=8675451&SID=319479553,Las Vegas,https://ak-d.tripcdn.com/images//0587012000s90ju6y10EE_C_568_320.jpg_.webp?_fr=wc
Las Vegas: WOW - The Vegas Spectacular at Rio Hotel & Casino,https://www.trip.com/things-to-do/detail/98761044/?Allianceid=8675451&SID=319479553,Las Vegas,https://ak-d.tripcdn.com/images//0585u12000ofjsbdk205E_C_568_320.jpg_.webp?_fr=wc
Las Vegas City Tour with Hotel Pick Up,https://www.trip.com/things-to-do/detail/100952882/?Allianceid=8675451&SID=319479553,Las Vegas,https://ak-d.tripcdn.com/images//0582s12000q4qcxaqB90F_C_568_320.jpg_.webp?_fr=wc
Grand Canyon West Rim Bus Tour and Hoover Dam Photo Stop,https://www.trip.com/things-to-do/detail/106760925/?Allianceid=8675451&SID=319479553,Las Vegas,https://ak-d.tripcdn.com/images//0586p12000s8z6sgg545E_C_568_320.jpg_.webp?_fr=wc
"1-day tour to Hoover Dam, Red Rock Canyon National Conservation Area and High Roller in Las Vegas, US",https://www.trip.com/things-to-do/detail/107410339/?Allianceid=8675451&SID=319479553,Las Vegas,https://ak-d.tripcdn.com/images/0350h12000sb8ybdj77C3_C_568_320.png_.webp?_fr=wc
Las Vegas strip + High Roller + Fountains of Bellagio + Sphere,https://www.trip.com/things-to-do/detail/107396997/?Allianceid=8675451&SID=319479553,Las Vegas,https://ak-d.tripcdn.com/images/0356312000sb8jauwC700_C_568_320.png_.webp?_fr=wc
Emerald Cave Kayak Experience with Optional Las Vegas Shuttle,https://www.trip.com/things-to-do/detail/38634745/?Allianceid=8675451&SID=319479553,Las Vegas,https://ak-d.tripcdn.com/images//0584012000nlfwpsc9D26_C_568_320.jpg_.webp?_fr=wc
Machine Guns Vegas - Firearms Experience,https://www.trip.com/things-to-do/detail/106760920/?Allianceid=8675451&SID=319479553,Las Vegas,https://ak-d.tripcdn.com/images//0586y12000s8z1cn97541_C_568_320.jpg_.webp?_fr=wc
Exotic Car Driving Experience at the Las Vegas Motor Speedway,https://www.trip.com/things-to-do/detail/16257921/?Allianceid=8675451&SID=319479553,Las Vegas,https://ak-d.tripcdn.com/images//0582n12000mz2sgupC167_C_568_320.jpg_.webp?_fr=wc
Las Vegas Trip Moments in the US,https://www.trip.com/things-to-do/detail/67743274/?Allianceid=8675451&SID=319479553,Las Vegas,"https://ak-d.tripcdn.com/images/0350d12000j0bpk1wA375_C_568_320.jpg_.webp?proc=crop/m_c,w_1440,h_1080,x_0,y_0,g_center,C2F5&_fr=wc"
Bliss With A Kiss,https://www.trip.com/things-to-do/detail/84184947/?Allianceid=8675451&SID=319479553,Las Vegas,https://ak-d.tripcdn.com/images//0581g12000n2cyg918CF1_C_568_320.jpg_.webp?_fr=wc
Grand Canyon South Rim tour from Las Vegas,https://www.trip.com/things-to-do/detail/83872076/?Allianceid=8675451&SID=319479553,Las Vegas,https://ak-d.tripcdn.com/images//0581f12000n27b0za39D1_C_568_320.jpg_.webp?_fr=wc
The Ultimate Las Vegas Tour by GPS Guided Talking GoCar,https://www.trip.com/things-to-do/detail/82267021/?Allianceid=8675451&SID=319479553,Las Vegas,https://ak-d.tripcdn.com/images//0584312000nwff3g2FBBB_C_568_320.jpg_.webp?_fr=wc
Off Road UTV and 3-Gun Shooting Package in Las Vegas,https://www.trip.com/things-to-do/detail/38302800/?Allianceid=8675451&SID=319479553,Las Vegas,https://ak-d.tripcdn.com/images//0586k12000nlhosgr63F2_C_568_320.jpg_.webp?_fr=wc
Upper Antelope Canyon and Horseshoe Bend Tour from Las Vegas,https://www.trip.com/things-to-do/detail/84529306/?Allianceid=8675451&SID=319479553,Las Vegas,https://ak-d.tripcdn.com/images//0581k12000n2ducp15BAA_C_568_320.jpg_.webp?_fr=wc
Grand Canyon West Rim bus tour with Hoover Dam photo stop and Skywalk ticket,https://www.trip.com/things-to-do/detail/84000080/?Allianceid=8675451&SID=319479553,Las Vegas,https://ak-d.tripcdn.com/images//0582b12000n29b3y43905_C_568_320.jpg_.webp?_fr=wc
"Travel in the US starting from Las Vegas, take a flight to explore the highlights of the Grand Canyon attraction",https://www.trip.com/things-to-do/detail/105440962/?Allianceid=8675451&SID=319479553,Las Vegas,https://ak-d.tripcdn.com/images/0354k12000s1nrmv883A6_C_568_320.jpg_.webp?_fr=wc
"Grand Canyon, Antelope Canyon, and Horseshoe Bend Day Tour",https://www.trip.com/things-to-do/detail/106875180/?Allianceid=8675451&SID=319479553,Las Vegas,https://ak-d.tripcdn.com/images//0581d12000shqm4r762D0_C_568_320.jpg_.webp?_fr=wc
"Grand Canyon West, Hoover Dam Stop, Breakfast, Lunch & Skywalk",https://www.trip.com/things-to-do/detail/106905594/?Allianceid=8675451&SID=319479553,Las Vegas,https://ak-d.tripcdn.com/images//0582r12000n0xx90uA008_C_568_320.jpg_.webp?_fr=wc
Death Valley Sunset and Stargazing Tour from Las Vegas,https://www.trip.com/things-to-do/detail/106787565/?Allianceid=8675451&SID=319479553,Las Vegas,https://ak-d.tripcdn.com/images//0583612000nso4m9q5BCF_C_568_320.jpg_.webp?_fr=wc
1-Day Grand Canyon Tour from Las Vegas: Stargazing & Sunrise,https://www.trip.com/things-to-do/detail/108735166/?Allianceid=8675451&SID=319479553,Las Vegas,https://ak-d.tripcdn.com/images/0353c12000nyuv538C79B_C_568_320.jpg_.webp?_fr=wc
Piano Man at Planet Hollywood Resort and Casino,https://www.trip.com/things-to-do/detail/92012564/?Allianceid=8675451&SID=319479553,Las Vegas,https://ak-d.tripcdn.com/images//0582d12000n3fcjmc8F20_C_568_320.jpg_.webp?_fr=wc
Bryce Canyon and Zion National Parks tour from Las Vegas,https://www.trip.com/things-to-do/detail/83891589/?Allianceid=8675451&SID=319479553,Las Vegas,https://ak-d.tripcdn.com/images//0581a12000n27m9ay5085_C_568_320.jpg_.webp?_fr=wc
Grand Canyon West Bus Tour with Hoover Dam and Optional Skywalk,https://www.trip.com/things-to-do/detail/106915094/?Allianceid=8675451&SID=319479553,Las Vegas,https://ak-d.tripcdn.com/images//0584n12000owtr5ln1C64_C_568_320.jpg_.webp?_fr=wc
"Depart from Las Vegas, USA, and take a flight to explore the highlights of the Grand Canyon attraction.",https://www.trip.com/things-to-do/detail/107697464/?Allianceid=8675451&SID=319479553,Las Vegas,https://ak-d.tripcdn.com/images/0354912000sejnlboAB1A_C_568_320.jpg_.webp?_fr=wc
Las Vegas: Antelope Canyon and Horseshoe Bend Day Trip,https://www.trip.com/things-to-do/detail/104871858/?Allianceid=8675451&SID=319479553,Las Vegas,https://ak-d.tripcdn.com/images/0353w12000notz1zc43D9_C_568_320.jpg_.webp?_fr=wc
Las Vegas Trip Moments in the US,https://www.trip.com/things-to-do/detail/102939994/?Allianceid=8675451&SID=319479553,Las Vegas,"https://ak-d.tripcdn.com/images/0356y12000r0waamuE7C9_C_568_320.jpg_.webp?proc=crop/m_c,w_800,h_600,x_117,y_32,g_center,5A63&_fr=wc"
Las Vegas Trip Moments in the US,https://www.trip.com/things-to-do/detail/102943450/?Allianceid=8675451&SID=319479553,Las Vegas,"https://ak-d.tripcdn.com/images/0355j12000r2mseuk74E2_C_568_320.jpg_.webp?proc=crop/m_c,w_1000,h_750,x_0,y_0,g_center,ECDD&_fr=wc"
"Las Vegas: Grand Canyon, Antelope Canyon, Horseshoe Bend",https://www.trip.com/things-to-do/detail/104901024/?Allianceid=8675451&SID=319479553,Las Vegas,https://ak-d.tripcdn.com/images//0584612000shqo3wqA889_C_568_320.jpg_.webp?_fr=wc
Award Winning Red Rock Canyon Tours,https://www.trip.com/things-to-do/detail/106924987/?Allianceid=8675451&SID=319479553,Las Vegas,https://ak-d.tripcdn.com/images//0586p12000notsmkv8707_C_568_320.jpg_.webp?_fr=wc
Las Vegas Mob Museum Admission Ticket,https://www.trip.com/things-to-do/detail/107094098/?Allianceid=8675451&SID=319479553,Las Vegas,https://ak-d.tripcdn.com/images//0585612000n1ijg2y0633_C_568_320.jpg_.webp?_fr=wc
1-Day Grand Canyon Antelope Horseshoe :Stargazing Daily tour,https://www.trip.com/things-to-do/detail/108756386/?Allianceid=8675451&SID=319479553,Las Vegas,https://ak-d.tripcdn.com/images/0354r12000nyuv5ay4CEE_C_568_320.jpg_.webp?_fr=wc
New York Trip Moments,https://www.trip.com/things-to-do/detail/67912469/?Allianceid=8675451&SID=319479553,Las Vegas,"https://ak-d.tripcdn.com/images/0355k12000j2kdi5t9503_C_568_320.jpg_.webp?proc=crop/m_c,w_1440,h_1080,x_0,y_0,g_center,C2F5&_fr=wc"
Las Vegas: Valley of Fire State Park Small Group Max 13 Tour,https://www.trip.com/things-to-do/detail/106263702/?Allianceid=8675451&SID=319479553,Las Vegas,https://ak-d.tripcdn.com/images/0350l12000nq1ky8pCCF2_C_568_320.jpg_.webp?_fr=wc
"Las Vegas: Grand Canyon West, Hoover Dam & Optional Skywalk",https://www.trip.com/things-to-do/detail/106057208/?Allianceid=8675451&SID=319479553,Las Vegas,https://ak-d.tripcdn.com/images/0350k12000nq0qyzo9DB7_C_568_320.png_.webp?_fr=wc
Las Vegas: Adults Only Night Tour + Drink,https://www.trip.com/things-to-do/detail/105846203/?Allianceid=8675451&SID=319479553,Las Vegas,https://ak-d.tripcdn.com/images/0351812000fz2tmt0935B_C_568_320.jpg_.webp?_fr=wc
Witches and Warlocks of Las Vegas Underworld 810 S Las Vegas Blvd,https://www.trip.com/things-to-do/detail/36486305/?Allianceid=8675451&SID=319479553,Las Vegas,https://ak-d.tripcdn.com/images//0586712000s2z1zwk067B_C_568_320.jpg_.webp?_fr=wc
Grand Canyon National Park Day Tour [South Rim + Lunch] Non-US Citizens Please Note Details,https://www.trip.com/things-to-do/detail/49464696/?Allianceid=8675451&SID=319479553,Las Vegas,https://ak-d.tripcdn.com/images/0353v12000ar2ho5oE708_C_568_320.jpg_.webp?_fr=wc
Grand Canyon National Park South Rim Tour with Lunch from Las Vegas,https://www.trip.com/things-to-do/detail/49719177/?Allianceid=8675451&SID=319479553,Las Vegas,https://ak-d.tripcdn.com/images/0353112000ma70ka45B66_C_568_320.jpg_.webp?_fr=wc
1-day tour to Grand Canyon West Rim from Las Vegas (9 hours),https://www.trip.com/things-to-do/detail/106895679/?Allianceid=8675451&SID=319479553,Las Vegas,https://ak-d.tripcdn.com/images/0352212000s9chprzF5AB_C_568_320.jpg_.webp?_fr=wc
Grand Canyon Nationl Park One Day Tour,https://www.trip.com/things-to-do/detail/22885124/?Allianceid=8675451&SID=319479553,Las Vegas,https://ak-d.tripcdn.com/images/0350p12000mpsv9syD6D6_C_568_320.jpg_.webp?_fr=wc
The United States Grand Canyon | Football World Cup 2026 Day Tour or Tickets,https://www.trip.com/things-to-do/detail/108153681/?Allianceid=8675451&SID=319479553,Las Vegas,https://ak-d.tripcdn.com/images/0352f12000sj33kroD2B8_C_568_320.png_.webp?_fr=wc
Sedona and Grand Canyon Full-Day Tour,https://www.trip.com/things-to-do/detail/106945843/?Allianceid=8675451&SID=319479553,Las Vegas,https://ak-d.tripcdn.com/images//0583a12000np4mug1F95A_C_568_320.jpg_.webp?_fr=wc
Grand Canyon National Park: Guided Sunset Hummer Tour,https://www.trip.com/things-to-do/detail/106300925/?Allianceid=8675451&SID=319479553,Las Vegas,https://ak-d.tripcdn.com/images//0583912000o9qbvsd1245_C_568_320.jpg_.webp?_fr=wc
From Flagstaff: Grand Canyon National Park Tour,https://www.trip.com/things-to-do/detail/106328300/?Allianceid=8675451&SID=319479553,Las Vegas,https://ak-d.tripcdn.com/images//0580i12000o746dr3F11E_C_568_320.jpg_.webp?_fr=wc
The Perfect Grand Canyon Tour with Local Expert Guides,https://www.trip.com/things-to-do/detail/106963636/?Allianceid=8675451&SID=319479553,Las Vegas,https://ak-d.tripcdn.com/images//0584a12000nwlvikm9A1C_C_568_320.jpg_.webp?_fr=wc
Grand Canyon South Rim Tour with Lunch included,https://www.trip.com/things-to-do/detail/105976072/?Allianceid=8675451&SID=319479553,Las Vegas,https://ak-d.tripcdn.com/images/0355k12000nq1toqrBA65_C_568_320.jpg_.webp?_fr=wc
Tusayan: Grand Canyon Desert View & South Rim Pink Jeep Tour,https://www.trip.com/things-to-do/detail/106207911/?Allianceid=8675451&SID=319479553,Las Vegas,https://ak-d.tripcdn.com/images//0580612000o99unvb9AFA_C_568_320.jpg_.webp?_fr=wc
Tusayan: Grand Canyon National Park Off Road Journey,https://www.trip.com/things-to-do/detail/108772772/?Allianceid=8675451&SID=319479553,Las Vegas,https://ak-d.tripcdn.com/images//0581b12000o46ykqb7F4F_C_568_320.jpg_.webp?_fr=wc
From Sedona: Grand Canyon Guided Tour,https://www.trip.com/things-to-do/detail/107565624/?Allianceid=8675451&SID=319479553,Las Vegas,https://ak-d.tripcdn.com/images//0581312000o3qym3oDDFE_C_568_320.jpg_.webp?_fr=wc
From Tusayan: Grand Canyon Desert View Sunset Tour,https://www.trip.com/things-to-do/detail/106208724/?Allianceid=8675451&SID=319479553,Las Vegas,https://ak-d.tripcdn.com/images//0583512000o9o96cpE483_C_568_320.jpg_.webp?_fr=wc
From Boulder City: Grand Canyon National Park South Rim Tour,https://www.trip.com/things-to-do/detail/106402742/?Allianceid=8675451&SID=319479553,Las Vegas,https://ak-d.tripcdn.com/images//0584312000oblee3e91A3_C_568_320.jpg_.webp?_fr=wc
Grand Canyon National Park: 2-Hour Small-Group Hummer Tour,https://www.trip.com/things-to-do/detail/106239923/?Allianceid=8675451&SID=319479553,Las Vegas,https://ak-d.tripcdn.com/images/0352e12000nvyw7950AEA_C_568_320.jpg_.webp?_fr=wc
Grand Canyon Complete Day Tour from Sedona or Flagstaff,https://www.trip.com/things-to-do/detail/107291147/?Allianceid=8675451&SID=319479553,Las Vegas,https://ak-d.tripcdn.com/images//0584o12000nsmyg1uA9BB_C_568_320.jpg_.webp?_fr=wc
Las Vegas: Grand Canyon National Park South Rim Guided Tour,https://www.trip.com/things-to-do/detail/106326916/?Allianceid=8675451&SID=319479553,Las Vegas,https://ak-d.tripcdn.com/images//0583d12000o5mkdw46A69_C_568_320.jpg_.webp?_fr=wc
Grand Canyon National Park South with Optional Upgrades,https://www.trip.com/things-to-do/detail/106863277/?Allianceid=8675451&SID=319479553,Las Vegas,https://ak-d.tripcdn.com/images//0582p12000nqdc0177DB7_C_568_320.jpg_.webp?_fr=wc
"Las Vegas: Grand Canyon, Antelope, Horseshoe, Lake Powell",https://www.trip.com/things-to-do/detail/106110415/?Allianceid=8675451&SID=319479553,Las Vegas,https://ak-d.tripcdn.com/images/0356512000nq0l74b6E0D_C_568_320.jpg_.webp?_fr=wc
Grand Canyon: 45-Min. Aerial Tour by Airplane,https://www.trip.com/things-to-do/detail/104897442/?Allianceid=8675451&SID=319479553,Las Vegas,https://ak-d.tripcdn.com/images/0354o12000q0nggv97D22_C_568_320.jpg_.webp?_fr=wc
Grand Canyon: Sunset Tour from Biblical Creation Perspective,https://www.trip.com/things-to-do/detail/106008728/?Allianceid=8675451&SID=319479553,Las Vegas,https://ak-d.tripcdn.com/images//0585e12000ob3wcap080E_C_568_320.jpg_.webp?_fr=wc
Las Vegas/Williams/Tusayan/Grand Canyon: One-Way Shuttle,https://www.trip.com/things-to-do/detail/105943996/?Allianceid=8675451&SID=319479553,Las Vegas,https://ak-d.tripcdn.com/images//0585z12000o5nssomD264_C_568_320.jpg_.webp?_fr=wc
Tonalea: Guided Eggshell Arch Hike w/ Day or Sunset Options,https://www.trip.com/things-to-do/detail/106247989/?Allianceid=8675451&SID=319479553,Las Vegas,https://ak-d.tripcdn.com/images//0585t12000ocoti4f76A1_C_568_320.jpg_.webp?_fr=wc
"Las Vegas: Grand Canyon National Park, Hoover Dam, Route 66",https://www.trip.com/things-to-do/detail/106112307/?Allianceid=8675451&SID=319479553,Las Vegas,https://ak-d.tripcdn.com/images/0351o12000npvwufo13C0_C_568_320.jpg_.webp?_fr=wc
Go City: Las Vegas Explorer Pass (Discover over 40 top attractions | Eiffel Tower Experience at Paris Las Vegas & more),https://www.trip.com/things-to-do/detail/46680368/?Allianceid=8675451&SID=319479553,Las Vegas,https://ak-d.tripcdn.com/images/0351q12000jiojuopB2AA_C_568_320.jpg_.webp?_fr=wc
Grand Canyon Tour from Flagstaff,https://www.trip.com/things-to-do/detail/107198739/?Allianceid=8675451&SID=319479553,Las Vegas,https://ak-d.tripcdn.com/images//0582r12000n15nlkr1814_C_568_320.jpg_.webp?_fr=wc
3 Hour Off-Road Sunset Safari to Grand Canyon with Entrance Gate Detour,https://www.trip.com/things-to-do/detail/107176382/?Allianceid=8675451&SID=319479553,Las Vegas,https://ak-d.tripcdn.com/images//0585d12000nqry9dn05DB_C_568_320.jpg_.webp?_fr=wc
Grand Canyon South Rim Tour with Lunch included,https://www.trip.com/things-to-do/detail/106857520/?Allianceid=8675451&SID=319479553,Las Vegas,https://ak-d.tripcdn.com/images//0585c12000o07uhyk4965_C_568_320.jpg_.webp?_fr=wc
Las Vegas: Grand Canyon West & Hoover Dam Tour + Breakfast,https://www.trip.com/things-to-do/detail/106197047/?Allianceid=8675451&SID=319479553,Las Vegas,https://ak-d.tripcdn.com/images/0354n12000nowdki7A073_C_568_320.jpg_.webp?_fr=wc
Grand Canyon South Rim Day Tour from Las Vegas,https://www.trip.com/things-to-do/detail/106983507/?Allianceid=8675451&SID=319479553,Las Vegas,https://ak-d.tripcdn.com/images//0582112000o0siur6AD23_C_568_320.jpg_.webp?_fr=wc
Las Vegas: Grand Canyon West Rim Tour with Optional Skywalk,https://www.trip.com/things-to-do/detail/106323288/?Allianceid=8675451&SID=319479553,Las Vegas,https://ak-d.tripcdn.com/images/0354b12000nvtil2e293E_C_568_320.jpg_.webp?_fr=wc
Grand Canyon Deluxe Day Trip from Sedona,https://www.trip.com/things-to-do/detail/107283174/?Allianceid=8675451&SID=319479553,Las Vegas,https://ak-d.tripcdn.com/images//0582f12000ns559s821E8_C_568_320.jpg_.webp?_fr=wc
Self-Guided Audio Driving Tour in Grand Canyon South Rim,https://www.trip.com/things-to-do/detail/106963482/?Allianceid=8675451&SID=319479553,Las Vegas,https://ak-d.tripcdn.com/images//0582712000nx0551m5DF8_C_568_320.jpg_.webp?_fr=wc
Desert View Grand Canyon Jeep Tour,https://www.trip.com/things-to-do/detail/107057007/?Allianceid=8675451&SID=319479553,Las Vegas,https://ak-d.tripcdn.com/images//0580e12000npu4ixs20BD_C_568_320.jpg_.webp?_fr=wc
Las Vegas: Antelope Canyon and Horseshoe Bend Airplane Tour,https://www.trip.com/things-to-do/detail/104918765/?Allianceid=8675451&SID=319479553,Las Vegas,https://ak-d.tripcdn.com/images//0580m12000sby5vf2CD2B_C_568_320.jpg_.webp?_fr=wc
From Las Vegas: Emerald Cave Guided Kayak Tour with Shuttle,https://www.trip.com/things-to-do/detail/106466971/?Allianceid=8675451&SID=319479553,Las Vegas,https://ak-d.tripcdn.com/images//0583t12000oa1upwk3147_C_568_320.jpg_.webp?_fr=wc
From Las Vegas: Emerald Cave Kayak Tour with Hotel Pickup,https://www.trip.com/things-to-do/detail/106314452/?Allianceid=8675451&SID=319479553,Las Vegas,https://ak-d.tripcdn.com/images//0586e12000o3kl8w123A9_C_568_320.jpg_.webp?_fr=wc
Las Vegas: Colorado River to Emerald Cave Half-Day Kayak,https://www.trip.com/things-to-do/detail/106118089/?Allianceid=8675451&SID=319479553,Las Vegas,https://ak-d.tripcdn.com/images//0586e12000o3kl8w123A9_C_568_320.jpg_.webp?_fr=wc
One-Day Tour from Guangzhou to Gu Long Xia Glass Grand Canyon in Qingyuan - Featuring the World's Longest Suspended Platform,https://www.trip.com/things-to-do/detail/106653598/?Allianceid=8675451&SID=319479553,Las Vegas,https://ak-d.tripcdn.com/images//0583j12000o2tn3xw8048_C_568_320.jpg_.webp?_fr=wc
1-day tour for 10 people to Zhangjiajie Tianmen Mountain + Grand Canyon glass bridge | Glass bridge + glass skywalk,https://www.trip.com/things-to-do/detail/95807277/?Allianceid=8675451&SID=319479553,Las Vegas,https://ak-d.tripcdn.com/images//0584h12000n0ia7eo1235_C_568_320.jpg_.webp?_fr=wc
Door-to-door pick-up and drop-off service | Zhangye day trip: Pingshan Lake Grand Canyon + Zhangye Danxia National Geological Park,https://www.trip.com/things-to-do/detail/105247085/?Allianceid=8675451&SID=319479553,Las Vegas,https://ak-d.tripcdn.com/images/0354s12000ss1nu2c814C_C_568_320.png_.webp?_fr=wc
Zhangye Colorful Danxia Scenic Spot & Pingshan Lake Grand Canyon Day Tour,https://www.trip.com/things-to-do/detail/99199759/?Allianceid=8675451&SID=319479553,Las Vegas,https://ak-d.tripcdn.com/images//0581e12000nxnwwhz908B_C_568_320.jpg_.webp?_fr=wc
One-Day Tour from Hohhot: Laoniuwan Yellow River Grand Canyon and Zhaojun Museum,https://www.trip.com/things-to-do/detail/104989306/?Allianceid=8675451&SID=319479553,Las Vegas,https://ak-d.tripcdn.com/images//0581d12000o2mf72k3420_C_568_320.jpg_.webp?_fr=wc
"Grand Canyon West Rim + Hoover Dam 1-day tour with English guide [Optional lunch, Skywalk]",https://www.trip.com/things-to-do/detail/49501570/?Allianceid=8675451&SID=319479553,Las Vegas,https://ak-d.tripcdn.com/images/0353j12000re9b5d65687_C_568_320.jpg_.webp?_fr=wc
"Half-day tour to Hoover Dam in the US, visit the Hoover Dam Museum",https://www.trip.com/things-to-do/detail/49640576/?Allianceid=8675451&SID=319479553,Las Vegas,https://ak-d.tripcdn.com/images/0353o12000apeiovq5762_C_568_320.jpg_.webp?_fr=wc
Half-day tour of Hoover Dam - Explore the Hoover Powerplant,https://www.trip.com/things-to-do/detail/53499816/?Allianceid=8675451&SID=319479553,Las Vegas,https://ak-d.tripcdn.com/images/0352t12000apeiusr2184_C_568_320.jpg_.webp?_fr=wc
From Las Vegas: Hoover Dam and Red Rock Canyon Combo Tour,https://www.trip.com/things-to-do/detail/108811299/?Allianceid=8675451&SID=319479553,Las Vegas,https://ak-d.tripcdn.com/images//0586u12000o44vyee8208_C_568_320.jpg_.webp?_fr=wc
Hoover Dam 1.5‑Hour Raft Tour in Black Canyon,https://www.trip.com/things-to-do/detail/106931525/?Allianceid=8675451&SID=319479553,Las Vegas,https://ak-d.tripcdn.com/images//0580812000n1mqi9vE625_C_568_320.jpg_.webp?_fr=wc
Las Vegas: Hoover Dam Express Tour,https://www.trip.com/things-to-do/detail/106306520/?Allianceid=8675451&SID=319479553,Las Vegas,https://ak-d.tripcdn.com/images/0355w12000nonbq7g2ABA_C_568_320.jpg_.webp?_fr=wc
"Las Vegas: Small Group Grand Canyon Skywalk, Hoover Dam Tour",https://www.trip.com/things-to-do/detail/106228549/?Allianceid=8675451&SID=319479553,Las Vegas,https://ak-d.tripcdn.com/images/0354e12000nonlc5bB5E7_C_568_320.jpg_.webp?_fr=wc
Las Vegas: Hoover Dam Tour with American-Style Hot Breakfast,https://www.trip.com/things-to-do/detail/106264013/?Allianceid=8675451&SID=319479553,Las Vegas,https://ak-d.tripcdn.com/images/0351m12000nwcl0gz55F5_C_568_320.jpg_.webp?_fr=wc
Hoover Dam Inside and Out,https://www.trip.com/things-to-do/detail/106959609/?Allianceid=8675451&SID=319479553,Las Vegas,https://ak-d.tripcdn.com/images//0583z12000nq07oae0E84_C_568_320.jpg_.webp?_fr=wc
Vegas: Grand Canyon West Rim Tour & Hoover Dam Photo Stop,https://www.trip.com/things-to-do/detail/107302910/?Allianceid=8675451&SID=319479553,Las Vegas,https://ak-d.tripcdn.com/images/0351e12000nq2hih3550B_C_568_320.jpg_.webp?_fr=wc
"Small Group Grand Canyon West Rim, Skywalk & Hoover Dam Tour",https://www.trip.com/things-to-do/detail/106256527/?Allianceid=8675451&SID=319479553,Las Vegas,https://ak-d.tripcdn.com/images/0351p12000npsnc2m151F_C_568_320.jpg_.webp?_fr=wc
"Small Group Tour: Grand Canyon West Rim, Skywalk & Hoover Dam",https://www.trip.com/things-to-do/detail/107007102/?Allianceid=8675451&SID=319479553,Las Vegas,https://ak-d.tripcdn.com/images//0582712000nrd4bw7DDF9_C_568_320.jpg_.webp?_fr=wc
From Las Vegas: Hoover Dam Highlights Tour,https://www.trip.com/things-to-do/detail/105923592/?Allianceid=8675451&SID=319479553,Las Vegas,https://ak-d.tripcdn.com/images//0581z12000o9kl8hw068C_C_568_320.jpg_.webp?_fr=wc
1-Day Tour to the Grand Canyon West Rim [Colorado West Rim 1-Day Tour],https://www.trip.com/things-to-do/detail/69205059/?Allianceid=8675451&SID=319479553,Las Vegas,https://ak-d.tripcdn.com/images/01052120008i7tvbk0A97_C_568_320.jpg_.webp?_fr=wc
Ultimate Hoover Dam Tour from Las Vegas,https://www.trip.com/things-to-do/detail/106936054/?Allianceid=8675451&SID=319479553,Las Vegas,https://ak-d.tripcdn.com/images//0581412000n16csrdC1C5_C_568_320.jpg_.webp?_fr=wc
"Las Vegas: Small Group Hoover Dam, Power Plant & Bridge Tour",https://www.trip.com/things-to-do/detail/106016227/?Allianceid=8675451&SID=319479553,Las Vegas,https://ak-d.tripcdn.com/images/0355v12000nov11jb7D87_C_568_320.jpg_.webp?_fr=wc
"Small Group Hoover Dam: From Above, On Top and Below Tour",https://www.trip.com/things-to-do/detail/106854775/?Allianceid=8675451&SID=319479553,Las Vegas,https://ak-d.tripcdn.com/images//0584j12000o0e7fcj7744_C_568_320.jpg_.webp?_fr=wc
Hoover Dam: 90-Minute Midday Sightseeing Cruise,https://www.trip.com/things-to-do/detail/106116706/?Allianceid=8675451&SID=319479553,Las Vegas,https://ak-d.tripcdn.com/images//0582n12000oc5m6by3144_C_568_320.jpg_.webp?_fr=wc
"Las Vegas: West Rim, Hoover Dam, Joshua Tree, Welcome Sign",https://www.trip.com/things-to-do/detail/105929416/?Allianceid=8675451&SID=319479553,Las Vegas,https://ak-d.tripcdn.com/images/0351i12000novq8p47CCB_C_568_320.jpg_.webp?_fr=wc
"Vegas: Grand Canyon, Hoover Dam, Skywalk Option, & Two Meals",https://www.trip.com/things-to-do/detail/106227039/?Allianceid=8675451&SID=319479553,Las Vegas,https://ak-d.tripcdn.com/images/0350d12000nw5waba79BF_C_568_320.jpg_.webp?_fr=wc
Grand Canyon West Airplane Air Tour from Vegas with transfer,https://www.trip.com/things-to-do/detail/106203291/?Allianceid=8675451&SID=319479553,Las Vegas,https://ak-d.tripcdn.com/images//0585u12000ofnxq8j5B18_C_568_320.jpg_.webp?_fr=wc
From Las Vegas: Boulder City Self-Guided Tour,https://www.trip.com/things-to-do/detail/106345033/?Allianceid=8675451&SID=319479553,Las Vegas,https://ak-d.tripcdn.com/images/0351512000nvt7cmhB121_C_568_320.jpg_.webp?_fr=wc
Las Vegas: Emerald Cave Kayak Tour with Photos,https://www.trip.com/things-to-do/detail/106225734/?Allianceid=8675451&SID=319479553,Las Vegas,https://ak-d.tripcdn.com/images//0580i12000odxewjxEC34_C_568_320.jpg_.webp?_fr=wc
Las Vegas: Kayak Tour to Cranes Nest Wash with Photos,https://www.trip.com/things-to-do/detail/106100478/?Allianceid=8675451&SID=319479553,Las Vegas,https://ak-d.tripcdn.com/images//0583f12000oe2qqymE436_C_568_320.jpg_.webp?_fr=wc
Las Vegas: Grand Canyon West Rim Tour with Skywalk option,https://www.trip.com/things-to-do/detail/106237344/?Allianceid=8675451&SID=319479553,Las Vegas,https://ak-d.tripcdn.com/images//0586412000ofodln9D7F2_C_568_320.jpg_.webp?_fr=wc
Las Vegas: Grand Canyon North ATV Tour with Scenic Flight,https://www.trip.com/things-to-do/detail/106315214/?Allianceid=8675451&SID=319479553,Las Vegas,https://ak-d.tripcdn.com/images//0580c12000o55yjn4CF08_C_568_320.jpg_.webp?_fr=wc
