title,url,city,image_url
Las Vegas: Grand Canyon West Tour & Optional Skywalk,https://www.trip.com/things-to-do/detail/106358966/?Allianceid=8675451&SID=319479553,Las Vegas,https://ak-d.tripcdn.com/images/0355512000novdhqg5941_C_568_320.jpg_.webp?_fr=wc
Las Vegas: Grand Canyon in Spanish with Skywalk and Lunch,https://www.trip.com/things-to-do/detail/106292231/?Allianceid=8675451&SID=319479553,Las Vegas,https://ak-d.tripcdn.com/images/0356x12000noqlnc9FBFB_C_568_320.jpg_.webp?_fr=wc
Half-Day Tour of the Colorado River + Hoover Dam [Rafting Adventure],https://www.trip.com/things-to-do/detail/49640307/?Allianceid=8675451&SID=319479553,Las Vegas,https://ak-d.tripcdn.com/images/0356312000aqxp85lE060_C_568_320.jpg_.webp?_fr=wc
"Hoover Dam Highlights Tour, Visit to the Hoover Dam Museum",https://www.trip.com/things-to-do/detail/49758644/?Allianceid=8675451&SID=319479553,Las Vegas,https://ak-d.tripcdn.com/images/0352h12000rgm522p9917_C_568_320.jpg_.webp?_fr=wc
Grand Canyon West + Joshua Tree Photostop + Hoover Dam Overlook + Hemenway Park Bus Tour,https://www.trip.com/things-to-do/detail/49723138/?Allianceid=8675451&SID=319479553,Las Vegas,https://ak-d.tripcdn.com/images/0356812000aozlf5cE61E_C_568_320.jpg_.webp?_fr=wc
Grand Canyon West Rim Tour and Hoover Dam Photo Stop,https://www.trip.com/things-to-do/detail/106760901/?Allianceid=8675451&SID=319479553,Las Vegas,https://ak-d.tripcdn.com/images//0585a12000s8yvjp1D4D3_C_568_320.jpg_.webp?_fr=wc
Grand Canyon West Rim bus tour with optional Skywalk and Hoover Dam Photo Stop,https://www.trip.com/things-to-do/detail/83915500/?Allianceid=8675451&SID=319479553,Las Vegas,https://ak-d.tripcdn.com/images//0580e12000n281luiDFE3_C_568_320.jpg_.webp?_fr=wc
"Upper or Lower or X Antelope Canyon, Horseshoe Bend Tour & Lunch",https://www.trip.com/things-to-do/detail/49702632/?Allianceid=8675451&SID=319479553,Las Vegas,https://ak-d.tripcdn.com/images/0350n12000re8bazu3C44_C_568_320.jpg_.webp?_fr=wc
"Comfortable bus - 1-day tour to Antelope Canyon & Horseshoe Bend including lunch, departing from Las Vegas",https://www.trip.com/things-to-do/detail/47469458/?Allianceid=8675451&SID=319479553,Las Vegas,https://ak-d.tripcdn.com/images/0351312000aqauad63D6B_C_568_320.jpg_.webp?_fr=wc
Lower Antelope Canyon Tour Ticket,https://www.trip.com/things-to-do/detail/106966906/?Allianceid=8675451&SID=319479553,Las Vegas,https://ak-d.tripcdn.com/images//0587312000nufwxan471D_C_568_320.jpg_.webp?_fr=wc
Antelope Valley: Upper Antelope Deer Canyon Tour,https://www.trip.com/things-to-do/detail/106198098/?Allianceid=8675451&SID=319479553,Las Vegas,https://ak-d.tripcdn.com/images//0584v12000od9ymyz4433_C_568_320.jpg_.webp?_fr=wc
Page: Upper Antelope Canyon Prime Time Entry & Navajo Guide,https://www.trip.com/things-to-do/detail/106082860/?Allianceid=8675451&SID=319479553,Las Vegas,https://ak-d.tripcdn.com/images//0585u12000oafd8y2FE37_C_568_320.jpg_.webp?_fr=wc
Antelope Canyon - Horseshoe Bend 1 Day Tour,https://www.trip.com/things-to-do/detail/22889641/?Allianceid=8675451&SID=319479553,Las Vegas,https://ak-d.tripcdn.com/images/100j08000000360yeABDD_C_568_320.jpg_.webp?_fr=wc
Lower Antelope Canyon Hiking Tour,https://www.trip.com/things-to-do/detail/106917238/?Allianceid=8675451&SID=319479553,Las Vegas,https://ak-d.tripcdn.com/images//0581z12000nuhfm7t3C99_C_568_320.jpg_.webp?_fr=wc
Page: Antelope Canyon X Guided Tour,https://www.trip.com/things-to-do/detail/106294558/?Allianceid=8675451&SID=319479553,Las Vegas,https://ak-d.tripcdn.com/images/0351t12000nvyvuy9EF6A_C_568_320.jpg_.webp?_fr=wc
Antelope Canyon and Horseshoe Bend Day Trip from Las Vegas,https://www.trip.com/things-to-do/detail/106854764/?Allianceid=8675451&SID=319479553,Las Vegas,https://ak-d.tripcdn.com/images//0582112000nqemjcsD025_C_568_320.jpg_.webp?_fr=wc
Page: Lower Antelope Canyon Prime-Time Guided Tour,https://www.trip.com/things-to-do/detail/106220185/?Allianceid=8675451&SID=319479553,Las Vegas,https://ak-d.tripcdn.com/images//0580312000oalgf6z047A_C_568_320.jpg_.webp?_fr=wc
Page: Lower Antelope Canyon Tour with Local Navajo Guide,https://www.trip.com/things-to-do/detail/104843306/?Allianceid=8675451&SID=319479553,Las Vegas,https://ak-d.tripcdn.com/images/0354212000nwaad8v8F9E_C_568_320.jpg_.webp?_fr=wc
Vegas: Antelope Canyon & Horseshoe Bend Tour at Golden Hour,https://www.trip.com/things-to-do/detail/107299753/?Allianceid=8675451&SID=319479553,Las Vegas,https://ak-d.tripcdn.com/images//0583j12000sbhzu3n61D8_C_568_320.jpg_.webp?_fr=wc
Lower Antelope Canyon Ticket,https://www.trip.com/things-to-do/detail/106848006/?Allianceid=8675451&SID=319479553,Las Vegas,https://ak-d.tripcdn.com/images//0583c12000nuhijpi04F8_C_568_320.jpg_.webp?_fr=wc
From Las Vegas: Lower Antelope Canyon & Horseshoe Bend Tour with Lunch,https://www.trip.com/things-to-do/detail/106247021/?Allianceid=8675451&SID=319479553,Las Vegas,https://ak-d.tripcdn.com/images/0355y12000ioi7feg9FEB_C_568_320.jpg_.webp?_fr=wc
From Las Vegas: Antelope Canyon and Horseshoe Bend Day Trip,https://www.trip.com/things-to-do/detail/106111504/?Allianceid=8675451&SID=319479553,Las Vegas,https://ak-d.tripcdn.com/images/0354i12000nop6gdr78D8_C_568_320.jpg_.webp?_fr=wc
From Sedona: Antelope Canyon and Horseshoe Bend Tour,https://www.trip.com/things-to-do/detail/107535357/?Allianceid=8675451&SID=319479553,Las Vegas,https://ak-d.tripcdn.com/images/0352012000nvb9p2775A3_C_568_320.jpg_.webp?_fr=wc
Page: Antelope Canyon X Hiking Tour with Photo Tour Option,https://www.trip.com/things-to-do/detail/105964813/?Allianceid=8675451&SID=319479553,Las Vegas,https://ak-d.tripcdn.com/images//0582812000ocg2guoAD5C_C_568_320.jpg_.webp?_fr=wc
Lower Antelope Canyon General Guided Tour,https://www.trip.com/things-to-do/detail/106884055/?Allianceid=8675451&SID=319479553,Las Vegas,https://ak-d.tripcdn.com/images//0583h12000n3djw576D04_C_568_320.jpg_.webp?_fr=wc
Page: Lower Antelope Canyon Ticket and Guided Hiking Tour,https://www.trip.com/things-to-do/detail/106110705/?Allianceid=8675451&SID=319479553,Las Vegas,https://ak-d.tripcdn.com/images//0581h12000oas68yg7411_C_568_320.jpg_.webp?_fr=wc
Lake Powell: Antelope Canyon 2-Hour Photo Boat Tour,https://www.trip.com/things-to-do/detail/106175182/?Allianceid=8675451&SID=319479553,Las Vegas,https://ak-d.tripcdn.com/images/0356d12000nzdk5fzB5C7_C_568_320.jpg_.webp?_fr=wc
Page: Antelope Valley Canyon Stargazing Night Hike,https://www.trip.com/things-to-do/detail/106184726/?Allianceid=8675451&SID=319479553,Las Vegas,https://ak-d.tripcdn.com/images//0580g12000sol68rn436C_C_568_320.jpg_.webp?_fr=wc
Antelope Canyon: Rams Head Canyon Tour,https://www.trip.com/things-to-do/detail/106221684/?Allianceid=8675451&SID=319479553,Las Vegas,https://ak-d.tripcdn.com/images//0582l12000odo016c985C_C_568_320.jpg_.webp?_fr=wc
Page: Guided Ligai Si Anii Antelope Canyon Tour,https://www.trip.com/things-to-do/detail/107565397/?Allianceid=8675451&SID=319479553,Las Vegas,https://ak-d.tripcdn.com/images//0580z12000q3hondz6A88_C_568_320.jpg_.webp?_fr=wc
Page: Lake Powell Kayak & Water Antelope Canyon Hiking Tour,https://www.trip.com/things-to-do/detail/106307990/?Allianceid=8675451&SID=319479553,Las Vegas,https://ak-d.tripcdn.com/images//0585p12000ocwkc6y154B_C_568_320.jpg_.webp?_fr=wc
Page/Lake Powell: Guided Kayak & Water Antelope Canyon Tour,https://www.trip.com/things-to-do/detail/106367678/?Allianceid=8675451&SID=319479553,Las Vegas,https://ak-d.tripcdn.com/images//0584t12000objjymd6BB8_C_568_320.jpg_.webp?_fr=wc
Antelope Canyon X: Guided Tour,https://www.trip.com/things-to-do/detail/106536761/?Allianceid=8675451&SID=319479553,Las Vegas,https://ak-d.tripcdn.com/images/0351a12000fzd64bqEC3E_C_568_320.jpg_.webp?_fr=wc
From Las Vegas: Upper Antelope Canyon & Horseshoe Bend Tour with Lunch,https://www.trip.com/things-to-do/detail/105576876/?Allianceid=8675451&SID=319479553,Las Vegas,https://ak-d.tripcdn.com/images/0354l12000fzcselt08CE_C_568_320.jpg_.webp?_fr=wc
Page: Antelope Valley Wind Pebble Canyon Tour,https://www.trip.com/things-to-do/detail/106172129/?Allianceid=8675451&SID=319479553,Las Vegas,https://ak-d.tripcdn.com/images//0580b12000od9xfug63D0_C_568_320.jpg_.webp?_fr=wc
Page: Antelope Canyon Horseshoe Bend & Glen Canyon Dam Tour,https://www.trip.com/things-to-do/detail/108796643/?Allianceid=8675451&SID=319479553,Las Vegas,https://ak-d.tripcdn.com/images//0586712000o4bfond5F7D_C_568_320.jpg_.webp?_fr=wc
Page: Secret Antelope Canyon and Horseshoe Bend Tour,https://www.trip.com/things-to-do/detail/106244939/?Allianceid=8675451&SID=319479553,Las Vegas,https://ak-d.tripcdn.com/images/0352n12000nw7znh0B1DB_C_568_320.jpg_.webp?_fr=wc
From Flagstaff: Antelope Canyon and Horseshoe Bend,https://www.trip.com/things-to-do/detail/106067882/?Allianceid=8675451&SID=319479553,Las Vegas,https://ak-d.tripcdn.com/images//0580h12000o9a0n39C704_C_568_320.jpg_.webp?_fr=wc
Page: Lower Antelope Canyon Prime Time Entry & Navajo Guide,https://www.trip.com/things-to-do/detail/105966670/?Allianceid=8675451&SID=319479553,Las Vegas,https://ak-d.tripcdn.com/images//0581e12000oc0s5zs71A7_C_568_320.jpg_.webp?_fr=wc
Page: Upper or Lower Antelope Canyon and Horseshoe Bend Tour,https://www.trip.com/things-to-do/detail/106083708/?Allianceid=8675451&SID=319479553,Las Vegas,https://ak-d.tripcdn.com/images//0580a12000oao5k4xC51C_C_568_320.jpg_.webp?_fr=wc
Antelope Canyon and Horseshoe Bend Day Trip,https://www.trip.com/things-to-do/detail/106177176/?Allianceid=8675451&SID=319479553,Las Vegas,https://ak-d.tripcdn.com/images/0350o12000q1e3ya18A1E_C_568_320.jpg_.webp?_fr=wc
Upper Antelope Canyon Entry and Guided Walking Tour,https://www.trip.com/things-to-do/detail/106391216/?Allianceid=8675451&SID=319479553,Las Vegas,https://ak-d.tripcdn.com/images/0356012000q0l7knk3686_C_568_320.jpg_.webp?_fr=wc
Page: Lower Antelope Canyon & Horseshoe Bend Guided Hike,https://www.trip.com/things-to-do/detail/105993099/?Allianceid=8675451&SID=319479553,Las Vegas,https://ak-d.tripcdn.com/images/0352t12000novjjtm1582_C_568_320.jpg_.webp?_fr=wc
Page: Antelope Canyon Boat Tour with Lake Powell & Glen Dam,https://www.trip.com/things-to-do/detail/106249205/?Allianceid=8675451&SID=319479553,Las Vegas,https://ak-d.tripcdn.com/images//0585x12000oazxpti9440_C_568_320.jpg_.webp?_fr=wc
Antelope Canyon Lake Powell: Guided Kayaking & Hike Tour,https://www.trip.com/things-to-do/detail/106374504/?Allianceid=8675451&SID=319479553,Las Vegas,https://ak-d.tripcdn.com/images//0584112000sp10jtu44B6_C_568_320.jpg_.webp?_fr=wc
Page: Upper & Lower Antelope Canyon & Horseshoe Bend Tour,https://www.trip.com/things-to-do/detail/105990231/?Allianceid=8675451&SID=319479553,Las Vegas,https://ak-d.tripcdn.com/images/0350312000nq1d4nz9ED8_C_568_320.jpg_.webp?_fr=wc
Page: Upper & Lower Antelope Canyon Guided Tour with Permit,https://www.trip.com/things-to-do/detail/106248105/?Allianceid=8675451&SID=319479553,Las Vegas,https://ak-d.tripcdn.com/images/0353u12000nov5ih18588_C_568_320.jpg_.webp?_fr=wc
Antelope Canyon: Guided Kayaking & Swimming Tour,https://www.trip.com/things-to-do/detail/106189723/?Allianceid=8675451&SID=319479553,Las Vegas,https://ak-d.tripcdn.com/images//0584612000od2xpbvF932_C_568_320.jpg_.webp?_fr=wc
"Vegas: Upper Antelope Canyon, Horseshoe Bend, Lake Powell",https://www.trip.com/things-to-do/detail/106315953/?Allianceid=8675451&SID=319479553,Las Vegas,https://ak-d.tripcdn.com/images//0580912000pqf7qr084A5_C_568_320.jpg_.webp?_fr=wc
"Vegas: Upper Antelope Canyon, Horseshoe Bend Tour with Lunch",https://www.trip.com/things-to-do/detail/106316601/?Allianceid=8675451&SID=319479553,Las Vegas,https://ak-d.tripcdn.com/images//0583712000o5me3nd38E1_C_568_320.jpg_.webp?_fr=wc
One-day Tour of Las Vegas | Football World Cup 2026 Day Tour or Tickets,https://www.trip.com/things-to-do/detail/108178598/?Allianceid=8675451&SID=319479553,Las Vegas,https://ak-d.tripcdn.com/images/0355612000sjedtvmA400_C_568_320.png_.webp?_fr=wc
Las Vegas: Antelope (PRIME TIME) Horseshoe Bend Lake Powell,https://www.trip.com/things-to-do/detail/108758370/?Allianceid=8675451&SID=319479553,Las Vegas,https://ak-d.tripcdn.com/images//0586712000o4bfond5F7D_C_568_320.jpg_.webp?_fr=wc
Page: Guided Deer Slot Canyon Tour,https://www.trip.com/things-to-do/detail/107568216/?Allianceid=8675451&SID=319479553,Las Vegas,https://ak-d.tripcdn.com/images//0580p12000o3t776e6141_C_568_320.jpg_.webp?_fr=wc
Page: Rams Head Canyon Guided Hike,https://www.trip.com/things-to-do/detail/107568519/?Allianceid=8675451&SID=319479553,Las Vegas,https://ak-d.tripcdn.com/images//0583x12000o3ta460F433_C_568_320.jpg_.webp?_fr=wc
Page: Sand Dune Slot Canyon Hiking Tour,https://www.trip.com/things-to-do/detail/107567950/?Allianceid=8675451&SID=319479553,Las Vegas,https://ak-d.tripcdn.com/images//0582s12000o3t9vz50E3B_C_568_320.jpg_.webp?_fr=wc
"Page, Arizona: Lake Powell Premium Kayak Rental",https://www.trip.com/things-to-do/detail/106059474/?Allianceid=8675451&SID=319479553,Las Vegas,https://ak-d.tripcdn.com/images//0580s12000odo97keA1DD_C_568_320.jpg_.webp?_fr=wc
"Shuttle Between Las Vegas, St George, Kanab and Page",https://www.trip.com/things-to-do/detail/106458486/?Allianceid=8675451&SID=319479553,Las Vegas,https://ak-d.tripcdn.com/images//0583712000o5me3nd38E1_C_568_320.jpg_.webp?_fr=wc
From Phoenix: Antelope Canyon & Horseshoe Bend Day Trip,https://www.trip.com/things-to-do/detail/106254429/?Allianceid=8675451&SID=319479553,Las Vegas,https://ak-d.tripcdn.com/images//0580r12000o9odnla8748_C_568_320.jpg_.webp?_fr=wc
Page: Lower & Upper Antelope Canyon + Lake Powell Boat Tour,https://www.trip.com/things-to-do/detail/106356016/?Allianceid=8675451&SID=319479553,Las Vegas,https://ak-d.tripcdn.com/images/0355p12000nou0c57EA6A_C_568_320.jpg_.webp?_fr=wc
Lower Antelope Canyon and Horseshoe Bend Day Tour with Lunch,https://www.trip.com/things-to-do/detail/41810391/?Allianceid=8675451&SID=319479553,Las Vegas,https://ak-d.tripcdn.com/images/0352o12000qtrrsyb17A9_C_568_320.png_.webp?_fr=wc
Lower Antelope Canyon and Horseshoe Bend Bus Tour (Includes Guide and Lunch During Golden Hours),https://www.trip.com/things-to-do/detail/104053684/?Allianceid=8675451&SID=319479553,Las Vegas,https://ak-d.tripcdn.com/images//0585a12000rj49eqf4061_C_568_320.jpg_.webp?_fr=wc
Page: Horseshoe Bend Colorado River Half Day Rafting Trip,https://www.trip.com/things-to-do/detail/108754155/?Allianceid=8675451&SID=319479553,Las Vegas,https://ak-d.tripcdn.com/images//0580112000o4qgsf2D116_C_568_320.jpg_.webp?_fr=wc
Self-Guided Audio Driving Tour in Death Valley National Park,https://www.trip.com/things-to-do/detail/106961615/?Allianceid=8675451&SID=319479553,Las Vegas,https://ak-d.tripcdn.com/images//0585q12000s9e9nxj2CE2_C_568_320.jpg_.webp?_fr=wc
"Luoyang, Henan: Longtan Grand Canyon & Red Rock Zhang Valley Geological Wonder Chinese Group Day Tour",https://www.trip.com/things-to-do/detail/96668593/?Allianceid=8675451&SID=319479553,Las Vegas,https://ak-d.tripcdn.com/images/0356i12000nikc1tj3C66_C_568_320.jpg_.webp?_fr=wc
Orderville: East Zion UTV Ride and Red Rock Slot Canyon Hike,https://www.trip.com/things-to-do/detail/106345763/?Allianceid=8675451&SID=319479553,Las Vegas,https://ak-d.tripcdn.com/images//0581012000q58xws78C60_C_568_320.jpg_.webp?_fr=wc
Las Vegas 3-Hour Red Rock Canyon Electric Bike Tour,https://www.trip.com/things-to-do/detail/106271611/?Allianceid=8675451&SID=319479553,Las Vegas,https://ak-d.tripcdn.com/images//0580k12000r5t2ovnC15B_C_568_320.jpg_.webp?_fr=wc
"Red Rock Canyon Talking GoCar Adventure — Fun, Self-Drive Tour",https://www.trip.com/things-to-do/detail/106982904/?Allianceid=8675451&SID=319479553,Las Vegas,https://ak-d.tripcdn.com/images//0581u12000n3jp3dv824E_C_568_320.jpg_.webp?_fr=wc
Red Rock Canyon with Rocky Gap Road 4x4 Jeep Tour,https://www.trip.com/things-to-do/detail/106958630/?Allianceid=8675451&SID=319479553,Las Vegas,https://ak-d.tripcdn.com/images//0584112000nqw2qjl843B_C_568_320.jpg_.webp?_fr=wc
Red Rock Canyon from Las Vegas,https://www.trip.com/things-to-do/detail/107004554/?Allianceid=8675451&SID=319479553,Las Vegas,https://ak-d.tripcdn.com/images//0585r12000npblajs1414_C_568_320.jpg_.webp?_fr=wc
Red Rock Canyon: Self-Guided Driving Tour,https://www.trip.com/things-to-do/detail/101467386/?Allianceid=8675451&SID=319479553,Las Vegas,https://ak-d.tripcdn.com/images/0354812000q1aoksg846F_C_568_320.jpg_.webp?_fr=wc
Leishan trip moments,https://www.trip.com/things-to-do/detail/105660860/?Allianceid=8675451&SID=319479553,Las Vegas,"https://ak-d.tripcdn.com/images/0354q12000s4fpkd9925E_C_568_320.jpg_.webp?proc=crop/m_c,w_4369,h_3276,x_0,y_0,g_center,A95A&_fr=wc"
Half-day Sedona Sightseeing Tour,https://www.trip.com/things-to-do/detail/107237036/?Allianceid=8675451&SID=319479553,Las Vegas,https://ak-d.tripcdn.com/images//0582f12000nqumnqh9A31_C_568_320.jpg_.webp?_fr=wc
Mount Lemmon Self-Guided Driving Audio Tour,https://www.trip.com/things-to-do/detail/106881950/?Allianceid=8675451&SID=319479553,Las Vegas,https://ak-d.tripcdn.com/images//0584n12000nx007h43D23_C_568_320.jpg_.webp?_fr=wc
Bryce Canyon National Park & Zion National Park Day Tour - Important Details for Non-US Citizens,https://www.trip.com/things-to-do/detail/49529250/?Allianceid=8675451&SID=319479553,Las Vegas,https://ak-d.tripcdn.com/images/0352612000rf67dylF0CD_C_568_320.jpg_.webp?_fr=wc
Bryce Canyon and Zion National Parks Day Tour From Las Vegas with Lunch,https://www.trip.com/things-to-do/detail/49757659/?Allianceid=8675451&SID=319479553,Las Vegas,https://ak-d.tripcdn.com/images/100i0q000000glz83D9E4_C_568_320.jpg_.webp?_fr=wc
Narikala Castle + Zion Cathedral of Tbilisi + Sulfur Baths + Mother of Kartli,https://www.trip.com/things-to-do/detail/103431735/?Allianceid=8675451&SID=319479553,Las Vegas,https://ak-d.tripcdn.com/images//0585m12000rab2zu6E45C_C_568_320.jpg_.webp?_fr=wc
Greater Zion: UTV Surf and Dune Ride at Sand Hollow Dunes,https://www.trip.com/things-to-do/detail/20432819/?Allianceid=8675451&SID=319479553,Las Vegas,https://ak-d.tripcdn.com/images//0585t12000njg65rj27E4_C_568_320.jpg_.webp?_fr=wc
Via Ferrata / Rappel Adventure in East Zion,https://www.trip.com/things-to-do/detail/37186059/?Allianceid=8675451&SID=319479553,Las Vegas,https://ak-d.tripcdn.com/images//0582g12000nlbt14w79D8_C_568_320.jpg_.webp?_fr=wc
Greater Zion: Epic Box Canyon UTV Tour,https://www.trip.com/things-to-do/detail/24928924/?Allianceid=8675451&SID=319479553,Las Vegas,https://ak-d.tripcdn.com/images//0586h12000mz9xpkt07DE_C_568_320.jpg_.webp?_fr=wc
Dark Sky UTV Tour with Stargazing in Greater Zion,https://www.trip.com/things-to-do/detail/20666188/?Allianceid=8675451&SID=319479553,Las Vegas,https://ak-d.tripcdn.com/images//0582312000ogk7jjsBC23_C_568_320.jpg_.webp?_fr=wc
Small-Group East Zion White Mountain Horseback Ride,https://www.trip.com/things-to-do/detail/38423169/?Allianceid=8675451&SID=319479553,Las Vegas,https://ak-d.tripcdn.com/images//0581712000nlhjm362ED3_C_568_320.jpg_.webp?_fr=wc
"3 Days / 2 Nights: Grand Canyon, Antelope, Bryce and Zion",https://www.trip.com/things-to-do/detail/107918492/?Allianceid=8675451&SID=319479553,Las Vegas,https://ak-d.tripcdn.com/images//0584312000s2mt11fF836_C_568_320.jpg_.webp?_fr=wc
Stargazing in Zion National Park's International Dark Sky,https://www.trip.com/things-to-do/detail/41107739/?Allianceid=8675451&SID=319479553,Las Vegas,https://ak-d.tripcdn.com/images//0587212000mzmpe9j6C3F_C_568_320.jpg_.webp?_fr=wc
In-Depth Hiking Tour of Zion National Park | Premium Small Group of No More Than 12 | Round-Trip from Las Vegas,https://www.trip.com/things-to-do/detail/101305718/?Allianceid=8675451&SID=319479553,Las Vegas,https://ak-d.tripcdn.com/images/0355412000resdp2pF5DB_C_568_320.png_.webp?_fr=wc
Vegas: Bryce & Zion Luxury Boutique Scenic Tour with Lunch,https://www.trip.com/things-to-do/detail/106291289/?Allianceid=8675451&SID=319479553,Las Vegas,https://ak-d.tripcdn.com/images//0580f12000srrzzow506F_C_568_320.jpg_.webp?_fr=wc
Old Tbilisi Highlights and Hidden Gems Guided Walking Tour 3 h,https://www.trip.com/things-to-do/detail/107138575/?Allianceid=8675451&SID=319479553,Las Vegas,https://ak-d.tripcdn.com/images//0583j12000n1k3m3f1595_C_568_320.jpg_.webp?_fr=wc
Greater Zion: UTV Tour to Toquerville Falls,https://www.trip.com/things-to-do/detail/106187558/?Allianceid=8675451&SID=319479553,Las Vegas,https://ak-d.tripcdn.com/images//0584b12000o9oa9iyF11F_C_568_320.jpg_.webp?_fr=wc
Bryce Canyon and Zion Park Combo Tour From Las Vegas,https://www.trip.com/things-to-do/detail/106387460/?Allianceid=8675451&SID=319479553,Las Vegas,https://ak-d.tripcdn.com/images/0353z12000norhb4a3719_C_568_320.jpg_.webp?_fr=wc
Early Morning Sunrise UTV Tour in Greater Zion,https://www.trip.com/things-to-do/detail/106051453/?Allianceid=8675451&SID=319479553,Las Vegas,https://ak-d.tripcdn.com/images//0580t12000oe5xzcrE789_C_568_320.jpg_.webp?_fr=wc
From Greater Zion: Extreme UTV Rock Crawling Tour,https://www.trip.com/things-to-do/detail/106104747/?Allianceid=8675451&SID=319479553,Las Vegas,https://ak-d.tripcdn.com/images//0580n12000o9mfs0k930D_C_568_320.jpg_.webp?_fr=wc
Springdale: Zion Watchman Sunset Hiking Tour,https://www.trip.com/things-to-do/detail/106172057/?Allianceid=8675451&SID=319479553,Las Vegas,https://ak-d.tripcdn.com/images//0583112000odbbfbvED89_C_568_320.jpg_.webp?_fr=wc
From Springdale: Zion Sunset Biking/eBiking Tour,https://www.trip.com/things-to-do/detail/106194019/?Allianceid=8675451&SID=319479553,Las Vegas,https://ak-d.tripcdn.com/images//0585q12000odanqo08812_C_568_320.jpg_.webp?_fr=wc
Orderville: East Zion Slot Canyons Award-Winning UTV Tour,https://www.trip.com/things-to-do/detail/106245377/?Allianceid=8675451&SID=319479553,Las Vegas,https://ak-d.tripcdn.com/images/0351o12000nwe902p9329_C_568_320.jpg_.webp?_fr=wc
Greater Zion: Sunset UTV Tour & Views of Zion National Park,https://www.trip.com/things-to-do/detail/106282780/?Allianceid=8675451&SID=319479553,Las Vegas,https://ak-d.tripcdn.com/images//0585c12000oddmwrxF068_C_568_320.jpg_.webp?_fr=wc
From Springdale: Zion National Park E-Bike Tour,https://www.trip.com/things-to-do/detail/106371238/?Allianceid=8675451&SID=319479553,Las Vegas,https://ak-d.tripcdn.com/images//0582i12000rw2768y6C43_C_568_320.jpg_.webp?_fr=wc
From Springdale: Greater Zion Scenic Hiking Tour,https://www.trip.com/things-to-do/detail/107298539/?Allianceid=8675451&SID=319479553,Las Vegas,https://ak-d.tripcdn.com/images//0586v12000sai7x8z6610_C_568_320.jpg_.webp?_fr=wc
East Zion: 1-Hour East Rim Jeep Tour,https://www.trip.com/things-to-do/detail/107298816/?Allianceid=8675451&SID=319479553,Las Vegas,https://ak-d.tripcdn.com/images//0580p12000sb13esj7E72_C_568_320.jpg_.webp?_fr=wc
Small Group Tour Zion & Bryce Canyon National from Las Vegas,https://www.trip.com/things-to-do/detail/106085173/?Allianceid=8675451&SID=319479553,Las Vegas,https://ak-d.tripcdn.com/images/0350v12000npzlnt3412F_C_568_320.jpg_.webp?_fr=wc
Springdale: Guided eBike Tour in Zion National Park,https://www.trip.com/things-to-do/detail/106395247/?Allianceid=8675451&SID=319479553,Las Vegas,https://ak-d.tripcdn.com/images//0587112000obdgx9tC033_C_568_320.jpg_.webp?_fr=wc
East Zion: Cliffs Sunset and Backcountry Off-Road Jeep Tour,https://www.trip.com/things-to-do/detail/107300984/?Allianceid=8675451&SID=319479553,Las Vegas,https://ak-d.tripcdn.com/images//0581212000sairdsk4468_C_568_320.jpg_.webp?_fr=wc
Greater Zion: Women's Only Guided UTV Tour,https://www.trip.com/things-to-do/detail/106120148/?Allianceid=8675451&SID=319479553,Las Vegas,https://ak-d.tripcdn.com/images//0585c12000oddh3z9B585_C_568_320.jpg_.webp?_fr=wc
From Las Vegas: Bryce Canyon and Zion Park Tour with Lunch,https://www.trip.com/things-to-do/detail/106366552/?Allianceid=8675451&SID=319479553,Las Vegas,https://ak-d.tripcdn.com/images/0352312000npunuzmBCD2_C_568_320.jpg_.webp?_fr=wc
East Zion: Crimson Slot Canyon Exploration and UTV Tour,https://www.trip.com/things-to-do/detail/106381432/?Allianceid=8675451&SID=319479553,Las Vegas,https://ak-d.tripcdn.com/images//0586a12000oa3f87j28FD_C_568_320.jpg_.webp?_fr=wc
Greater Zion: Ride-Along UTV Tour with views of Zion,https://www.trip.com/things-to-do/detail/106350576/?Allianceid=8675451&SID=319479553,Las Vegas,https://ak-d.tripcdn.com/images//0586t12000oddidt52955_C_568_320.jpg_.webp?_fr=wc
Orderville: East Zion Park White Mountain Horseback Tour,https://www.trip.com/things-to-do/detail/107298938/?Allianceid=8675451&SID=319479553,Las Vegas,https://ak-d.tripcdn.com/images//0586f12000sb16x9e2F89_C_568_320.jpg_.webp?_fr=wc
Greater Zion: ATV Excursion to Ancient Indian Petroglyphs,https://www.trip.com/things-to-do/detail/106119473/?Allianceid=8675451&SID=319479553,Las Vegas,https://ak-d.tripcdn.com/images//0585u12000oe5nbvw4964_C_568_320.jpg_.webp?_fr=wc
Sunset Chasing ATV Adventure near Zion National Park,https://www.trip.com/things-to-do/detail/106330066/?Allianceid=8675451&SID=319479553,Las Vegas,https://ak-d.tripcdn.com/images//0586j12000r674psw1F0A_C_568_320.jpg_.webp?_fr=wc
From Springdale: 4-hour Zion Canyon Scenic Hiking Tour,https://www.trip.com/things-to-do/detail/107298461/?Allianceid=8675451&SID=319479553,Las Vegas,https://ak-d.tripcdn.com/images//0584j12000sai6wxcDF50_C_568_320.jpg_.webp?_fr=wc
Las Vegas: Zion National Park Small Group Tour with Lunch,https://www.trip.com/things-to-do/detail/108759719/?Allianceid=8675451&SID=319479553,Las Vegas,https://ak-d.tripcdn.com/images//0585h12000o3rtwer4102_C_568_320.jpg_.webp?_fr=wc
"Shuttle between Las Vegas, Bryce, Zion and St George",https://www.trip.com/things-to-do/detail/106018425/?Allianceid=8675451&SID=319479553,Las Vegas,https://ak-d.tripcdn.com/images//0583712000o5me3nd38E1_C_568_320.jpg_.webp?_fr=wc
Greater Zion: Family Friendly UTV Tour near Zion,https://www.trip.com/things-to-do/detail/106119937/?Allianceid=8675451&SID=319479553,Las Vegas,https://ak-d.tripcdn.com/images/0350w12000nwejrc33E81_C_568_320.jpg_.webp?_fr=wc
