title,url,city,image_url
Tijuana Food Tasting: Tijuana Day Tour from San Diego,https://www.trip.com/things-to-do/detail/17422782/?Allianceid=8675451&SID=319479553,San Diego,https://ak-d.tripcdn.com/images//0586p12000mz4ybi5614F_C_568_320.jpg_.webp?_fr=wc
USS Midway Museum: Skip The Line Ticket,https://www.trip.com/things-to-do/detail/101500865/?Allianceid=8675451&SID=319479553,San Diego,https://ak-d.tripcdn.com/images/0355k12000j989rqgFD92_C_568_320.jpg_.webp?_fr=wc
San Diego Harbor Cruise,https://www.trip.com/things-to-do/detail/106975782/?Allianceid=8675451&SID=319479553,San Diego,https://ak-d.tripcdn.com/images//0582j12000nue3kuy9DEA_C_568_320.jpg_.webp?_fr=wc
Explore Coronado Island by E-Scooter with Photos Included,https://www.trip.com/things-to-do/detail/82290276/?Allianceid=8675451&SID=319479553,San Diego,https://ak-d.tripcdn.com/images//0587012000nwtmvvlE0B5_C_568_320.jpg_.webp?_fr=wc
Port of San Diego + Balboa Park + USS Midway Museum + Sunset Cliffs Natural Park,https://www.trip.com/things-to-do/detail/105384233/?Allianceid=8675451&SID=319479553,San Diego,https://ak-d.tripcdn.com/images/0350z12000rzwpj0bD9B5_C_568_320.png_.webp?_fr=wc
San Diego Whale Watching Cruise,https://www.trip.com/things-to-do/detail/17505861/?Allianceid=8675451&SID=319479553,San Diego,https://ak-d.tripcdn.com/images//0585x12000njadtbyFDE4_C_568_320.jpg_.webp?_fr=wc
"1-day private chartered tour to Old Town, La Jolla Shores Park and San Diego Zoo",https://www.trip.com/things-to-do/detail/105380214/?Allianceid=8675451&SID=319479553,San Diego,https://ak-d.tripcdn.com/images/0354b12000rzwr2nf933F_C_568_320.png_.webp?_fr=wc
"1-day private chartered tour to Port of San Diego, San Diego Zoo and USS Midway Museum",https://www.trip.com/things-to-do/detail/105380982/?Allianceid=8675451&SID=319479553,San Diego,https://ak-d.tripcdn.com/images/0350y12000s0q5pqwFE88_C_568_320.png_.webp?_fr=wc
SeaWorld San Diego + Balboa Park + Sunset Cliffs Natural Park,https://www.trip.com/things-to-do/detail/105381871/?Allianceid=8675451&SID=319479553,San Diego,https://ak-d.tripcdn.com/images/0351p12000rzwr36h04BF_C_568_320.png_.webp?_fr=wc
1-day tour to SeaWorld San Diego + Old Town + Sunset Cliffs Natural Park,https://www.trip.com/things-to-do/detail/105383100/?Allianceid=8675451&SID=319479553,San Diego,https://ak-d.tripcdn.com/images/0352b12000rzwqtpaBB15_C_568_320.png_.webp?_fr=wc
San Diego Zoo Safari Park 1-Day Pass: Any Day Ticket,https://www.trip.com/things-to-do/detail/17506022/?Allianceid=8675451&SID=319479553,San Diego,https://ak-d.tripcdn.com/images//0581512000r956qke84F8_C_568_320.jpg_.webp?_fr=wc
Go city San Diego all-inclusive pass [official/50+ top attractions/San Diego Zoo] San Diego all-inclusive pass,https://www.trip.com/things-to-do/detail/46680882/?Allianceid=8675451&SID=319479553,San Diego,https://ak-d.tripcdn.com/images/0355o12000jgxgtth08BB_C_568_320.jpg_.webp?_fr=wc
Glow Nightime Pedal Boat Rental in San Diego Bay,https://www.trip.com/things-to-do/detail/30075319/?Allianceid=8675451&SID=319479553,San Diego,https://ak-d.tripcdn.com/images//0585m12000nkbdsa19428_C_568_320.jpg_.webp?_fr=wc
Stand up Paddle Board Lesson on The San Diego Bay,https://www.trip.com/things-to-do/detail/21973075/?Allianceid=8675451&SID=319479553,San Diego,https://ak-d.tripcdn.com/images//0587012000mz9dl7q24CC_C_568_320.jpg_.webp?_fr=wc
Coronado GoCar 2 hr self-drive (optional day/night time + island sightseeing),https://www.trip.com/things-to-do/detail/108427630/?Allianceid=8675451&SID=319479553,San Diego,https://ak-d.tripcdn.com/images/0352x12000sm64wwlE8CF_C_568_320.png_.webp?_fr=wc
1-day tour to San Diego Zoo + Unconditional Surrender + La Jolla Cove + La Jolla Shores Park,https://www.trip.com/things-to-do/detail/105380925/?Allianceid=8675451&SID=319479553,San Diego,https://ak-d.tripcdn.com/images/0355512000rzwqdjz7B92_C_568_320.png_.webp?_fr=wc
SeaWorld San Diego + Old Town + La Jolla Cove + La Jolla Shores Park,https://www.trip.com/things-to-do/detail/105382979/?Allianceid=8675451&SID=319479553,San Diego,https://ak-d.tripcdn.com/images/0352412000s0pu6sq276C_C_568_320.png_.webp?_fr=wc
San Diego Zoo and Safari Park 2-Visit Pass Ticket,https://www.trip.com/things-to-do/detail/17506126/?Allianceid=8675451&SID=319479553,San Diego,https://ak-d.tripcdn.com/images//0584j12000r9hqb85D808_C_568_320.jpg_.webp?_fr=wc
San Diego: Hop-on Hop-off Narrated Trolley Tour,https://www.trip.com/things-to-do/detail/106366119/?Allianceid=8675451&SID=319479553,San Diego,https://ak-d.tripcdn.com/images//0586x12000oa1trhl782F_C_568_320.jpg_.webp?_fr=wc
Tijuana Toe Dip: Day Trip from San Diego,https://www.trip.com/things-to-do/detail/106963722/?Allianceid=8675451&SID=319479553,San Diego,https://ak-d.tripcdn.com/images//0583r12000nqz2p8z949C_C_568_320.jpg_.webp?_fr=wc
Maritime Museum of San Diego Admission Ticket,https://www.trip.com/things-to-do/detail/107040698/?Allianceid=8675451&SID=319479553,San Diego,https://ak-d.tripcdn.com/images//0586c12000nube517504A_C_568_320.jpg_.webp?_fr=wc
Intro to Mexico Walking Tour: Tijuana Day Trip from San Diego,https://www.trip.com/things-to-do/detail/106935829/?Allianceid=8675451&SID=319479553,San Diego,https://ak-d.tripcdn.com/images//0582712000nqd239c9573_C_568_320.jpg_.webp?_fr=wc
